show_id,type,title,director,cast,country,date_added,release_year,rating,duration,listed_in,description,Index,IMDB_Rating,year_added
s1145,Movie,Yes Man,Peyton Reed,"Jim Carrey, Zooey Deschanel, Bradley Cooper, John Michael Higgins, Rhys Darby, Danny Masterson, Fionnula Flanagan, Terence Stamp, Sasha Alexander, Molly Sims","United States, United Kingdom",2021-04-01,2008,PG-13,104 min,"Comedies, Romantic Movies","After a bitter divorce, a loan officer falls under the sway of a self-help guru who urges him to say yes to everything that comes his way for a year.",1144,6.8,2021.0
s1130,TV Show,Secrets of Great British Castles,,Dan Jones,United Kingdom,2021-04-01,2016,TV-PG,2 Seasons,"British TV Shows, Docuseries, International TV Shows",Join historian Dan Jones on a journey back in time to the zenith of Britain's most iconic structures and their infamous inhabitants.,1129,7.7,2021.0
s1131,Movie,Seven Souls in the Skull Castle: Season Bird,Hidenori Inoue,"Sadao Abe, Mirai Moriyama, Taichi Saotome, Yasuko Matsuyuki, Makoto Awane, Tenkyu Fukuda, Yusuke Shoji, Hazuki Shimizu, Zen Kajihara, Narushi Ikeda",,2021-04-01,2017,TV-14,182 min,"Action & Adventure, Dramas, International Movies","Japan, 1590. Wandering samurai band together to take on the lord of Skull Castle in this “Bird” version of the dynamic show performed in a 360º theater.",1130,6.5,2021.0
s1132,Movie,Seven Souls in the Skull Castle: Season Flower,Hidenori Inoue,"Shun Oguri, Koji Yamamoto, Songha, Ryo, Munetaka Aoki, Nana Seino, Yoshimasa Kondo, Arata Furuta",Japan,2021-04-01,2017,TV-14,181 min,"Action & Adventure, Dramas, International Movies","Japan, 1590. Wandering samurai band together to take on the lord of Skull Castle in this “Flower” version of the bold show performed in a 360º theater.",1131,6.9,2021.0
s1129,Movie,S.W.A.T.: Under Siege,Tony Giglio,"Sam Jaeger, Michael Jai White, Adrianne Palicki, Ty Olsson, Kyra Zagorsky, Olivia Cheng, Lisa Chandler, Monique Ganderton, Matthew Marsden, Chris Gauthier",United States,2021-04-01,2017,R,89 min,"Action & Adventure, International Movies","When a S.W.A.T. team takes in a mysterious, high-profile prisoner, international threats unleash a barrage of attacks on their compound to retrieve him.",1128,4.6,2021.0
s1121,Movie,Kingsglaive: Final Fantasy XV,Takeshi Nozue,"Aaron Paul, Lena Headey, Sean Bean, Adrian Bouchet, Liam Mulvey, Alexa Kahn, Todd Haberkorn, John DeMita, David Gant, Darin De Paul","Japan, United States",2021-04-01,2016,PG-13,116 min,"Action & Adventure, Sci-Fi & Fantasy",King Regis of Lucis orders his Kingsglaive warriors to stop the army of Niflheim before it invades and steals the crystal that gives Lucis its power.,1120,6.7,2021.0
s1114,Movie,2012,Roland Emmerich,"John Cusack, Amanda Peet, Chiwetel Ejiofor, Thandie Newton, Oliver Platt, Tom McCarthy, Woody Harrelson, Danny Glover, Liam James, Morgan Lily",United States,2021-04-01,2009,PG-13,158 min,"Action & Adventure, Sci-Fi & Fantasy","When a flood of natural disasters begins to destroy the world, a divorced dad desperately tries to save his family by outrunning the cataclysmic chaos.",1113,5.8,2021.0
s1115,Movie,3 Idiots,Rajkumar Hirani,"Aamir Khan, Kareena Kapoor, Madhavan, Sharman Joshi, Omi Vaidya, Boman Irani, Mona Singh, Javed Jaffrey",India,2021-04-01,2009,PG-13,164 min,"Comedies, Dramas, International Movies","While attending one of India's premier colleges, three miserable engineering students and best friends struggle to beat the school's draconian system.",1114,8.4,2021.0
s1116,Movie,Ferrari Ki Sawaari,Rajesh Mapuskar,"Sharman Joshi, Boman Irani, Ritwik Sahore, Paresh Rawal, Deepak Shirke, Satyadeep Misra, Aakash Dabhade, Nilesh Diwekar, Vidya Balan",India,2021-04-01,2012,TV-PG,133 min,"Comedies, International Movies, Sports Movies",A father winds up involved with a stolen Ferrari as he tries to acquire the money to send his son to the leading cricket academy.,1115,6.4,2021.0
s1117,TV Show,Glimpses of a Future,,,,2021-04-01,2020,TV-PG,1 Season,"Docuseries, International TV Shows","This docuseries celebrates the virtual collaborations between a group of artists, dancers and writers from around the world during the pandemic.",1116,6.6,2021.0
s1118,Movie,Ibrahim a Fate to Define,Lina Al Abed,,"Lebanon, Palestine, Denmark, Qatar",2021-04-01,2019,TV-PG,75 min,"Documentaries, International Movies","Raised in a quiet home, Lina searches for answers while investigating the mystery behind her father's disappearance in this documentary.",1117,7.5,2021.0
s1119,Movie,Insidious,James Wan,"Patrick Wilson, Rose Byrne, Lin Shaye, Ty Simpkins, Barbara Hershey, Leigh Whannell, Angus Sampson, Andrew Astor, Joseph Bishara","United States, Canada",2021-04-01,2010,PG-13,103 min,"Horror Movies, Thrillers","A family moves into a new home, where their son falls into a coma and eerie events begin to reveal something far more sinister is lurking in the house.",1118,6.8,2021.0
s1120,Movie,Into the Grizzly Maze,David Hackl,"James Marsden, Thomas Jane, Billy Bob Thornton, Piper Perabo, Scott Glenn, Michaela McManus, Adam Beach, Kelly Curran","United States, Canada",2021-04-01,2015,R,90 min,"Action & Adventure, Horror Movies",Estranged brothers Beckett and Rowan reunite in the Alaskan wild to confront a savage grizzly bear wreaking havoc on their hometown.,1119,5.3,2021.0
s1122,Movie,Legally Blonde,Robert Luketic,"Reese Witherspoon, Luke Wilson, Selma Blair, Matthew Davis, Victor Garber, Jennifer Coolidge",United States,2021-04-01,2001,PG-13,96 min,"Comedies, Romantic Movies","When dazzling L.A. sorority girl Elle Woods gets dumped by her snobby boyfriend, she decides to win him back by following him to Harvard Law School.",1121,6.5,2021.0
s1123,Movie,Madam Chief Minister,Subhash Kapoor,"Richa Chadda, Saurabh Shukla, Manav Kaul, Shubrajyoti Barat, Akshay Oberoi, Boloram Das, Nikhil Vijay, Raviza Chauhan",India,2021-04-01,2020,TV-14,121 min,"Dramas, International Movies","Rising from disadvantage to become a state leader, a tenacious politician learns that with great power comes great responsibility, ruthlessness and risk.",1122,4.9,2021.0
s1124,TV Show,Magical Andes,,,"Uruguay, Germany",2021-04-01,2021,TV-G,2 Seasons,"Docuseries, International TV Shows, Science & Nature TV","From Argentina to Colombia, this stunning documentary follows five characters who share their deep connection to South America's majestic mountains.",1123,7.7,2021.0
s1125,Movie,Maximum Risk,Ringo Lam,"Jean-Claude Van Damme, Natasha Henstridge, Jean-Hugues Anglade, Zach Grenier, Paul Ben-Victor, Frank Senger, Stéphane Audran",United States,2021-04-01,1996,R,101 min,Action & Adventure,"After discovering he's a twin when a look-alike turns up dead, a French cop assumes his brother's identity to uncover the truth and seek vengeance.",1124,5.5,2021.0
s1126,TV Show,Murder Maps,,Nicholas Day,United Kingdom,2021-04-01,2017,TV-MA,2 Seasons,"British TV Shows, Crime TV Shows, Docuseries",Dramatic reenactments paired with archival sources artfully illustrate how police brought some of Britain's most infamous killers to justice.,1125,7.5,2021.0
s1127,Movie,My Fair Lady,George Cukor,"Audrey Hepburn, Rex Harrison, Stanley Holloway, Wilfred Hyde-White, Gladys Cooper, Jeremy Brett, Theodore Bikel, Mona Washbourne, Isobel Elsom, John Holland, Alan Napier, Marni Nixon",United States,2021-04-01,1964,G,173 min,"Classic Movies, Music & Musicals","When a Cockney flower girl takes elocution lessons from an aloof professor, he decides to introduce her to high society, transforming both their lives.",1126,7.7,2021.0
s1128,TV Show,Prank Encounters,,Gaten Matarazzo,United States,2021-04-01,2021,TV-MA,2 Seasons,"Reality TV, TV Comedies, TV Horror",Monstrous frights meet hilarious reveals on this hidden-camera prank show as real people become the stars of their own full-blown horror movie.,1127,5.3,2021.0
s1148,Movie,Not a Game,Jose Gomez,Brendon Mcdonnell,United Kingdom,2021-03-31,2020,TV-MA,98 min,"Documentaries, International Movies, Sports Movies","This documentary offers an honest look at our fraught, complex relationship to video games from the perspectives of gamers and their concerned parents.",1147,9.2,2021.0
s1150,TV Show,Yu-Gi-Oh!,,"Dan Green, Eric Stuart, Amy Birnbaum, Darren Dunstan, Wayne Grayson, Tara Sands, Lisa Ortiz, Megan Hollingshead, Madeleine Blaustein, Sam Riegel, Ted Lewis, Gregory Abbey, Jimmy Zoppi",Japan,2021-03-31,2005,TV-Y7,1 Season,"Anime Series, Kids' TV","The lives of young Yugi Moto and his friends Joey, Tristan, and Téa are forever changed when a fantasy card game becomes their reality.",1149,7.3,2021.0
s1149,TV Show,Robocar Poli,,"Donald Reignoux, Alexis Tomassian, Thomas Sagols, Pierre Francois Pistori, Bruno Magne, Catherine Desplaces, Fily Keita, Adeline Chetail, Bertrand Liebert, Christophe Lemoine",South Korea,2021-03-31,2015,TV-Y,2 Seasons,"Kids' TV, Korean TV Shows","When disaster strikes in Brooms Town, police car Robocar Poli, fire truck Robotruck Roy and their friends on the rescue team race to save the day.",1148,6.0,2021.0
s1147,TV Show,Haunted: Latin America,Adrián García Bogliano,,"United States, Mexico",2021-03-31,2021,TV-14,1 Season,"International TV Shows, Reality TV, Spanish-Language TV Shows","Real people's terrifying tales of the chilling, unexplained and paranormal come to life with dramatic reenactments in this reality series.",1146,5.3,2021.0
s1146,Movie,At Eternity's Gate,Julian Schnabel,"Willem Dafoe, Rupert Friend, Oscar Isaac, Mads Mikkelsen, Mathieu Amalric, Emmanuelle Seigner, Niels Arestrup, Anne Consigny, Amira Casar, Vincent Perez, Lolita Chammah, Stella Schnabel, Vladimir Consigny","Ireland, Switzerland, United Kingdom, France, United States",2021-03-31,2018,PG-13,111 min,Dramas,Wild artistic inspiration and emotional turmoil fill painter Vincent van Gogh's last years as he struggles to bring his unique vision to the world.,1145,6.9,2021.0
s1151,Movie,7 Yards: The Chris Norton Story,Jonathon Link,Chris Norton,United States,2021-03-30,2021,TV-PG,93 min,Documentaries,"The true story of former college football player Chris Norton, who defied the odds after a devastating accident — with the woman he loves by his side.",1150,7.8,2021.0
s1152,Movie,Octonauts & the Ring of Fire,Blair Simmons,"Simon Greenall, Rob Rackstraw, Jo Wyatt, Paul Buckley, Simon Foster, Teresa Gallagher, Richard Grieve, Michael Murphy, Paul Panting, Keith Wickham","China, United Kingdom",2021-03-30,2021,TV-Y,73 min,Children & Family Movies,"When red-hot volcanoes start a chain reaction of disasters across the ocean, the Octonauts must work together to face their biggest challenge yet.",1151,7.7,2021.0
s1153,TV Show,Rainbow High,,"Tara Sands, Anairis Quiñones, Laura Stahl, Jenny Yokobori, Kira Buckland, Brittany Cox, Brittany Lauda, Christian Banas, Rebeka Thomas, Hayden Summerall, Deneen Melody",United States,2021-03-30,2020,TV-Y,1 Season,Kids' TV,"The popular fashion dolls come to life in this animated series as they let their talents and true colors shine at the visual arts school, Rainbow High.",1152,5.7,2021.0
s1154,Movie,Mandela: Long Walk to Freedom,Justin Chadwick,"Idris Elba, Naomie Harris, Tony Kgoroge, Riaad Moosa, Zolani Mkiva, Simo Mogwaza, Fana Mokoena, Thapelo Mokoena, Jamie Bartlett, Deon Lotz, Terry Pheto, Mark Elderkin","United Kingdom, South Africa, France",2021-03-29,2013,PG-13,141 min,"Dramas, International Movies",This in-depth biopic portrays groundbreaking South African leader Nelson Mandela's fight against political oppression and virulent racism.,1153,7.1,2021.0
s1155,Movie,Lawless,John Hillcoat,"Shia LaBeouf, Jessica Chastain, Jason Clarke, Guy Pearce, Lew Temple, Gary Oldman, Tim Tolin, Dane DeHaan, Mia Wasikowska, Chris McGarry, Tom Hardy",United States,2021-03-28,2012,R,116 min,Dramas,"This true-to-life action saga profiles Virginia's bootlegging Bondurant brothers, whose exploits during the Prohibition era made them outlaw heroes.",1154,7.2,2021.0
s1156,Movie,Marked,Nadine Ibrahim,,Nigeria,2021-03-28,2021,TV-PG,21 min,"Documentaries, International Movies","This documentary explores Nigeria’s cultural practice of marking, including its origins and meaning as a symbol of identity, beauty and spirituality.",1155,5.9,2021.0
s1163,Movie,Keeping the Bees,Eylem Kaftan,"Meryem Uzerli, Feyyaz Duman, Hakan Karsak, Şennur Nogaylar, Burcu Salihoğlu",Turkey,2021-03-26,2020,TV-14,93 min,"Dramas, International Movies",Ayşe returns from Germany to her Black Sea hometown and sets out to fulfill her mom's dying wish — to care for her beloved bee farms.,1162,5.8,2021.0
s1167,TV Show,The Irregulars,,"Mckell David, Thaddea Graham, Jojo Macari, Harrison Osterfield, Darci Shaw, Clarke Peters, Royce Pierreson, Henry Lloyd-Hughes",United Kingdom,2021-03-26,2021,TV-14,1 Season,"British TV Shows, Crime TV Shows, International TV Shows","A crew of misfits investigates a series of supernatural crimes in Victorian London for Dr. Watson and his shadowy associate, Sherlock Holmes.",1166,6.1,2021.0
s1166,Movie,Pagglait,Umesh Bist,"Sanya Malhotra, Sayani Gupta, Ashutosh Rana, Raghuvir Yadav, Shruti Sharma, Sheeba Chaddha, Natasha Rastogi, Rajesh Tailang, Meghna Malik, Jameel Khan, Chetan Sharma, Ananya Khare, Bhupesh Pandya",India,2021-03-26,2021,TV-PG,114 min,"Comedies, Dramas, International Movies","Widowed soon after marriage, a young woman grapples with an inability to grieve, quirky relatives and a startling discovery about her late husband.",1165,6.9,2021.0
s1165,Movie,Ni de coña,Fernando Ayllón,"Nathalie Seseña, Goyo Jiménez, José Juan Vaquero, Jordi Sánchez, Ricardo Quevedo, Carolina Noriega, Max Marieges, Kikín Fernández, Norma Nivia, Moi Camacho",Spain,2021-03-26,2020,TV-MA,97 min,"Comedies, International Movies","Trying to fix their relationships, four couples attend a spiritual retreat at a Caribbean resort, where temptation and mishaps add problems to the mix.",1164,2.8,2021.0
s1164,TV Show,Magic for Humans Spain,,Antonio Díaz,Spain,2021-03-26,2021,TV-MA,1 Season,"International TV Shows, Reality TV, Spanish-Language TV Shows","In this Spanish adaptation of ""Magic for Humans,"" folks of all ages on the streets of Barcelona are amazed by tricks that inspire delight and wonder.",1163,7.2,2021.0
s1159,TV Show,Big Time Rush,,"Kendall Schmidt, James Maslow, Carlos Pena, Logan Henderson, Ciara Bravo, Stephen Kramer Glickman, Tanya Chisholm, Challen Cates, Erin Sanders, Matt Riedy",United States,2021-03-26,2013,TV-G,4 Seasons,Kids' TV,"After a talent agent discovers four talented pals and turns them into a boy band called Big Time Rush, they must adjust to their exciting new lives.",1158,6.5,2021.0
s1162,Movie,Elizabeth and Margaret: Love and Loyalty,,,United Kingdom,2021-03-26,2020,TV-PG,87 min,Documentaries,"This documentary takes an intimate look at the complex, widely misunderstood relationship between Queen Elizabeth II and her sister, Princess Margaret.",1161,7.5,2021.0
s1161,Movie,Croupier,Mike Hodges,"Clive Owen, Kate Hardie, Alex Kingston, Gina McKee, Nicholas Ball, Nick Reding, Alexander Morton","Ireland, United Kingdom, France, Germany",2021-03-26,1998,TV-MA,95 min,"Dramas, Independent Movies, Thrillers","A would-be writer lands a job as a croupier to make ends meet. But when he becomes involved with a gambler, he is lured into taking part in a heist.",1160,7.0,2021.0
s1160,Movie,Black Is Beltza,Fermín Muguruza,"Unax Ugalde, Isaach De Bankolé, Iseo, Sergi López, Ramón Agirre, Jorge Perugorría, Angelo Moore, Maria de Medeiros",,2021-03-26,2018,TV-MA,87 min,"Dramas, International Movies",A young Basque man is radicalized in 1960s America after being forbidden from participating in a parade on racial grounds.,1159,5.9,2021.0
s1158,Movie,Bad Trip,,"Eric André, Lil Rel Howery, Tiffany Haddish, Michaela Conlin",United States,2021-03-26,2021,TV-MA,87 min,Comedies,"In this hidden-camera prank comedy, two best friends bond on a wild road trip to New York as they pull real people into their raunchy, raucous antics.",1157,6.5,2021.0
s1157,Movie,A Week Away,Roman White,"Kevin Quinn, Bailee Madison, Jahbril Cook, Kat Conner Sterling, Sherri Shepherd, David Koechner, Iain Tucker, Amy Grant",United States,2021-03-26,2021,TV-PG,98 min,"Children & Family Movies, Faith & Spirituality, Music & Musicals","In this uplifting musical, a troubled teen takes a leap of faith by attending summer camp — and unexpectedly finds love, friends and a place to belong.",1156,5.8,2021.0
s1171,Movie,Secret Magic Control Agency,Aleksey Tsitsilin,"Nicholas Corda, Sylvana Joyce, Alyson Leigh Rosenfeld, Courtney Shaw, Erica Schroeder, Georgette Timoney, Mary O'Brady, Marc Thompson","Russia, United States",2021-03-25,2021,TV-Y7,105 min,"Children & Family Movies, Comedies","Hansel and Gretel of fairy tale fame — now acting as secret agents — must use magic, clever thinking and teamwork on a mission to find a missing king.",1170,6.2,2021.0
s1170,TV Show,Pui Pui Molcar,,,Japan,2021-03-25,2021,TV-Y7,1 Season,Kids' TV,They’re guinea pigs! And they’re cars! The fuzzy and adorable molcars have lots of fun adventures in this delightful stop-motion animation.,1169,8.0,2021.0
s1168,Movie,Caught by a Wave,Massimiliano Camaiti,"Elvira Camarrone, Christian Roberto, Donatella Finocchiaro, Corrado Invernizzi, Vincenzo Amato, Manuela Ventura, Rosalba Battaglia, Daniele Pilli",Italy,2021-03-25,2021,TV-14,100 min,"Dramas, International Movies, Romantic Movies","After falling in love at a sailing summer camp in Sicily, reality comes crashing down on a teenage couple when a harsh truth prompts a pivotal decision.",1167,5.8,2021.0
s1169,TV Show,DOTA: Dragon's Blood,,"Yuri Lowenthal, Lara Pulver, Kari Wahlgren, Alix Wilton Regan, Troy Baker, Freya Tingley, Tony Todd",United States,2021-03-25,2021,TV-MA,1 Season,Anime Series,A conflicted yet courageous Dragon Knight must use the power of the dragon within to stop a deadly demon in this epic fantasy based on the online game.,1168,7.7,2021.0
s1172,Movie,Seaspiracy,Ali Tabrizi,,United States,2021-03-24,2021,TV-14,90 min,Documentaries,"Passionate about ocean life, a filmmaker sets out to document the harm that humans do to marine species — and uncovers alarming global corruption.",1171,8.1,2021.0
s1173,Movie,Loyiso Gola: Unlearning,Kagiso Lediga,Loyiso Gola,South Africa,2021-03-23,2021,TV-MA,60 min,Stand-Up Comedy,"South African comedian Loyiso Gola serves up filter-free humor as he riffs about race, identity, politics, and a school prank gone embarrassingly wrong!",1172,6.0,2021.0
s1175,TV Show,Navillera,,"Park In-hwan, Song Kang, Na Moon-hee, Hong Seung-hee, Cho Seong-ha, Kim Tae-hun, Cheong Hae-kyun, Kim Soo-jin, Jo Bok-rae, Kim Kwon",South Korea,2021-03-23,2021,TV-14,1 Season,"International TV Shows, TV Dramas",A 70-year-old with a dream and a 23-year-old with a gift lift each other out of harsh realities and rise to the challenge of becoming ballerinos.,1174,8.7,2021.0
s1176,Movie,Philomena,Stephen Frears,"Judi Dench, Steve Coogan, Sophie Kennedy Clark, Mare Winningham, Barbara Jefford, Ruth McCabe, Peter Hermann, Sean Mahon, Anna Maxwell Martin, Michelle Fairley, Kate Fleetwood","United Kingdom, United States, France",2021-03-22,2013,PG-13,98 min,"Dramas, Independent Movies, International Movies",A kind-hearted Irishwoman teams with an acerbic journalist to find the son she was forced to give up for adoption 50 years ago.,1175,7.6,2021.0
s1179,Movie,Jiu Jitsu,Dimitri Logothetis,"Alain Moussi, Nicolas Cage, Tony Jaa, Rick Yune, Frank Grillo, Marie Avgeropoulos, JuJu Chan, Ryan Tarran, Eddie Steeples, Raymond Pinharry, Mary Makariou",United States,2021-03-20,2020,R,102 min,Action & Adventure,"After the defeat of a celebrated war hero, an ancient order of fighters battles powerful space invaders as the fate of humanity hangs in the balance.",1178,2.9,2021.0
s1180,TV Show,Mighty Morphin Power Rangers,,"Austin St. John, Thuy Trang, Walter Jones, Amy Jo Johnson, David Yost, Jason David Frank, Johnny Yong Bosch, Karan Ashley, Steve Cardenas, Catherine Sutherland, Paul Schrier, Jason Narvy, David Fielding, Richard Steven Horvitz, Barbara Goodson","United States, Japan",2021-03-20,2010,TV-Y7,4 Seasons,Kids' TV,"Five average teens are chosen by an intergalactic wizard to become the Power Rangers, who must use their new powers to fight the evil Rita Repulsa.",1179,6.6,2021.0
s1178,Movie,Hospital,Brody Chu,"Lin Po-Hung, Tai Bo, Jacqueline Zhu, Lei Hong, Hsu Lichi, Yoko Young, Samuel Gu, Eunice Lin",Taiwan,2021-03-20,2020,TV-MA,90 min,"Horror Movies, International Movies","In an abandoned hospital in Tainan, visitors seeking to communicate with their relatives' spirits are haunted by disturbing, supernatural occurrences.",1177,6.6,2021.0
s1177,Movie,Any Crybabies Around?,Takuma Sato,"Taiga Nakano, Riho Yoshioka, Kanichiro, Takashi Yamanaka, Kimiko Yo, Toshiro Yanagiba",Japan,2021-03-20,2020,TV-MA,108 min,"Dramas, International Movies",An immature young father in Akita becomes an outcast in his community after a media incident. Two years later he returns to ineptly try to make amends.,1176,6.0,2021.0
s1181,TV Show,Alien TV,,"Rob Tinkler, Julie Lemieux, John Cleland, Kyle Dooley, Rupert Degas",,2021-03-19,2021,TV-Y7,2 Seasons,"Kids' TV, TV Comedies","Alien reporters Ixbee, Pixbee and Squee travel to a lovely but odd planet called Earth, where they attempt to make sense of humans and their hobbies.",1180,6.4,2021.0
s1182,TV Show,Country Comfort,,"Katharine McPhee, Eddie Cibrian, Ricardo Hurtado, Jamie Martin Mann, Griffin McIntyre, Shiloh Verrico, Pyper Braun, Janet Varney, Eric Balfour",United States,2021-03-19,2021,TV-PG,1 Season,TV Comedies,"After hitting the skids in her career, an aspiring country singer finds new life as a nanny for a handsome widower and his five charming children.",1181,6.8,2021.0
s1183,TV Show,Formula 1: Drive to Survive,,,United Kingdom,2021-03-19,2021,TV-MA,3 Seasons,Docuseries,"Drivers, managers and team owners live life in the fast lane – both on and off the track – during one cutthroat season of Formula 1 racing.",1182,8.5,2021.0
s1184,Movie,Reframe THEATER EXPERIENCE with you,Taketoshi Sado,Perfume,,2021-03-19,2020,TV-G,84 min,"International Movies, Music & Musicals","Perfume's Reframe 2019 concert, performed to great effect in the newly reconstructed Line Cube Shibuya, is recreated as a high-tech concert film.",1183,5.9,2021.0
s1185,Movie,The Yin Yang Master,Li Weiran,"Chen Kun, Zhou Xun, Qu Chuxiao, Shen Yue, William Chan Wai-ting, Wang Likun, Cici Wang",China,2021-03-19,2021,TV-14,120 min,"Action & Adventure, International Movies","A feud erupts between realms, and Yin Yang master Qing Ming teams up with disgraced guard Yuan Boya to vanquish a demonic threat as a conspiracy looms.",1184,6.4,2021.0
s1186,Movie,Who's the Boss,Chinaza Onuzo,"Funke Akindele, Blossom Chukwujekwu, Sharon Ooja, Ini Dima-Okojie, Segun Arinze, Bolly Lomo, Beverly Osu, Tayo Faniran",Nigeria,2021-03-19,2020,TV-MA,106 min,"Comedies, International Movies, Romantic Movies","A young, overworked ad executive with an overbearing boss starts her own side hustle and invents an employer once her business begins to flourish.",1185,6.6,2021.0
s1190,Movie,Nate Bargatze: The Greatest Average American,Troy Miller,Nate Bargatze,United States,2021-03-18,2021,TV-G,60 min,Stand-Up Comedy,"Nate Bargatze touches on Zoom comedy shows, losing his phone, hotel breakfast fails, animal caddies, new math and much more in this special.",1189,7.4,2021.0
s1193,Movie,The Present,Farah Nabulsi,"Saleh Bakri, Maryam Kanj, Maryam Kamiel Basha, Ameer Khlawe, Ala' Hanani, Malak Abu Ghraibeh, Karam Elayyan, Leila Mouammar, Angie Saba","United Kingdom,",2021-03-18,2020,TV-MA,24 min,"Dramas, International Movies","Yusuf and his daughter set out to buy his wife an anniversary gift, a gesture demanding much patience and negotiation skills in the West Bank.",1192,5.7,2021.0
s1191,Movie,Skylines,Liam O'Donnell,"Lindsey Morgan, Jonathan Howard, Daniel Bernhardt, Rhona Mitra, James Cosmo, Yayan Ruhian, Alexander Siddig, Cha-Lee Yoon, Ieva Andrejevaite, Jeremy Fitzgerald","United Kingdom, United States",2021-03-18,2020,R,113 min,Action & Adventure,"When a mysterious alien virus begins to endanger humanity, an elite team of soldiers launches into space to end the threat for good.",1190,4.8,2021.0
s1192,Movie,The Fluffy Movie,"Manny Rodriguez, Jay Lavender",Gabriel Iglesias,United States,2021-03-18,2014,PG-13,101 min,Stand-Up Comedy,"Comedian Gabriel Iglesias takes the stage in San Jose, California, for a stand-up performance featuring wild stories and even wilder impersonations.",1191,7.2,2021.0
s1189,Movie,Get the Goat,Vitor Brandt,"Matheus Nachtergaele, Edmilson Filho, Letícia Lima, Leandro Ramos, Evelyn Castro, Valéria Vitoriano, Victor Allen, Renan Medeiros, Eyrio Okura, Jéssica Tamochunas, Marcondes Falcão, Juliano Cazarré",Brazil,2021-03-18,2021,TV-14,98 min,"Action & Adventure, Comedies, International Movies","Two hapless cops find themselves in over their heads as they cross paths with dangerous criminals while searching for Celestina, a beloved goat mascot.",1188,6.1,2021.0
s1188,Movie,Deadly Illusions,Anna Elizabeth James,"Kristin Davis, Dermot Mulroney, Greer Grammer, Shanola Hampton, Marie Wagenman, Shylo Molina, Abella Bala, Shaun Wu",United States,2021-03-18,2021,R,115 min,Thrillers,"After a bestselling novelist suffering from writer's block hires a new nanny for her children, the line between fiction and reality starts to blur.",1187,3.8,2021.0
