show_id,type,title,director,cast,country,date_added,release_year,rating,duration,listed_in,description,Index,IMDB_Rating,year_added
s800,Movie,Million Dollar Baby,Clint Eastwood,"Clint Eastwood, Hilary Swank, Morgan Freeman, Anthony Mackie, Jay Baruchel, Mike Colter, Lucia Rijker, Brían F. O'Byrne, Margo Martindale, Riki Lindhome",United States,2021-06-02,2004,PG-13,133 min,"Dramas, Sports Movies","When a cantankerous trainer mentors a persistent amateur boxer determined to go pro, deep-seated emotions become their strongest opponents.",799,8.1,2021.0
s820,Movie,The Outlaw Josey Wales,Clint Eastwood,"Clint Eastwood, Sondra Locke, Chief Dan George, Bill McKinney, John Vernon, Paula Trueman, Sam Bottoms, Geraldine Keams, Woodrow Parfrey, Joyce Jameson",United States,2021-06-02,1976,PG,136 min,"Action & Adventure, Classic Movies","In this gritty Oscar-nominated Western, an ex-Confederate soldier on the run comes to rest in a quiet community, where he falls for a pretty settler.",819,7.8,2021.0
s821,TV Show,The Platform,,"Maxim Khalil, Abdulmohsen Alnemr, Samr Ismaiel, Khaled Alkeesh, Samar Sami, Salloum Haddad, Ahmad Aljasmii, Khaled El Sayed, Yaser Alneyadi, Leen Gherra, Dean Cain, Moatasem Alnahar, Mahira Abdelaziz",United Arab Emirates,2021-06-02,2021,TV-14,3 Seasons,"International TV Shows, TV Dramas, TV Mysteries","A programming genius builds a fact-finding, truth-seeking internet portal while reckoning with trouble at home.",820,7.0,2021.0
s822,Movie,The Wedding Guest,Michael Winterbottom,"Dev Patel, Radhika Apte, Jim Sarbh",United Kingdom,2021-06-02,2018,R,97 min,"Dramas, Romantic Movies, Thrillers","Hired to extract a bride-to-be before her arranged wedding in Pakistan, a hired gun goes on the run with his hostage when his plan unravels.",821,5.8,2021.0
s823,Movie,The Wind,Emma Tammi,"Caitlin Gerard, Julia Goldani Telles, Ashley Zukerman, Miles Anderson, Dylan McTee",United States,2021-06-02,2019,R,88 min,Horror Movies,"Isolated on a wind-ravaged 19th-century homestead, a frontierswoman begins to suspect that evil lurks in the terrifying emptiness all around her.",822,8.2,2021.0
s824,Movie,Then Came You,Peter Hutchings,"Asa Butterfield, Maisie Williams, Nina Dobrev, Ken Jeong, Tyler Hoechlin, David Koechner, Peyton List, Tituss Burgess",United States,2021-06-02,2019,TV-MA,97 min,"Comedies, Dramas, Independent Movies",A hypochondriac confronts his fear of death when a terminally ill teen girl enlists him to help her complete her bucket list.,823,6.9,2021.0
s825,Movie,Welcome Home,George Ratliff,"Aaron Paul, Emily Ratajkowski, Riccardo Scamarcio, Katy Louise Saunders, Alice Bellagamba",United States,2021-06-02,2018,R,97 min,Thrillers,"A couple rents a villa in Italy hoping to mend their bruised relationship, but the devilishly charming homeowner can’t seem to leave them alone.",824,5.2,2021.0
s801,Movie,Mosquita y Mari,Aurora Guerrero,"Fenessa Pineda, Venecia Troncoso, Joaquín Garrido, Laura Patalano, Dulce Maria Solis, Marisela Uscanga, Melissa Uscanga, Omar Leyva, Tonita Castro, Paul Alayo",United States,2021-06-02,2012,TV-14,85 min,"Dramas, Independent Movies, LGBTQ Movies","Neighbors but by no means friends, high schoolers Yolanda and Mari discover a bond and an attraction when they're made study partners.",800,6.3,2021.0
s802,Movie,Never Back Down 2: The Beatdown,Michael Jai White,"Michael Jai White, Dean Geyer, Alex Meraz, Todd Duffee, Scottie Epstein, Jillian Murray, Evan Peters, Stacey Asaro, Gralen Bryant Banks, Rus Blackwell",United States,2021-06-02,2011,R,104 min,"Action & Adventure, Dramas, Sports Movies",A group of mixed martial arts fighters stars in this action thriller that follows a quartet of brawlers as they prepare for a major underground event.,801,5.7,2021.0
s799,Movie,Love Jones,Theodore Witcher,"Larenz Tate, Nia Long, Isaiah Washington, Lisa Nicole Carson, Bill Bellamy, Leonard Roberts, Bernadette L. Clarke, Khalil Kain",United States,2021-06-02,1997,R,109 min,"Comedies, Dramas, Independent Movies",A poet and a photographer take a chance on romance but find their ambitions and baggage could keep them from taking their relationship further.,798,7.3,2021.0
s786,TV Show,Cocomelon,,,United States,2021-06-02,2021,TV-Y,3 Seasons,Kids' TV,"Learn letters, numbers, animal sounds and more with J.J. in this edutaining series that brings fun times with nursery rhymes for the whole family!",785,4.0,2021.0
s775,Movie,2 Hearts,Lance Hool,"Jacob Elordi, Adan Canto, Radha Mitchell, Tiera Skovbye, Kari Matchett, Tahmoh Penikett",United States,2021-06-02,2020,PG-13,101 min,"Dramas, Faith & Spirituality, Romantic Movies","In parallel love stories, the lives of college student Chris and wealthy businessman Jorge intersect in a profound twist of fate. Based on a true story.",774,6.3,2021.0
s776,Movie,A Perfect Ending,Nicole Conn,"Barbara Niven, Jessica Clark, John Heard, Morgan Fairchild, Kerry Knuppe, Imelda Corcoran, Mary Jane Wells, Rebecca Staab, Michael Adam Hamilton, Bryan Jackson, Bryan Mordechai Jackson",United States,2021-06-02,2012,TV-MA,110 min,"Dramas, Independent Movies, LGBTQ Movies","After confessing an unusual secret, a repressed wife – prompted by her friends – decides to explore her sexuality with a high-priced call girl.",775,5.6,2021.0
s777,Movie,American Outlaws,Les Mayfield,"Colin Farrell, Scott Caan, Ali Larter, Gabriel Macht, Gregory Smith, Harris Yulin, Kathy Bates, Timothy Dalton, Ty O'Neal, Will McCormack, Ronny Cox, Terry O'Quinn, Muse Watson, Joe Stevens, Barry Tubb",United States,2021-06-02,2001,PG-13,94 min,Action & Adventure,"In the wake of the Civil War, Jesse James leads a feisty group of ranchers in a fight against a railroad baron bent on seizing their land at any cost.",776,5.9,2021.0
s778,Movie,And Then Came Lola,"Ellen Seidler, Megan Siler","Ashleigh Sumner, Jill Bennett, Cathy DeBuono, Jessica Graham, Angelyna Martinez, Candy Tolentino, Linda Ignazi, Jenoa Harlow, Lisa Dewey, Kathy Domenici",United States,2021-06-02,2009,TV-MA,70 min,"Comedies, Independent Movies, LGBTQ Movies","In this lesbian-themed nod to the film Run Lola Run, a photographer races against the clock to make it to an important meeting on time.",777,4.0,2021.0
s798,Movie,I Am Sam,Jessie Nelson,"Sean Penn, Michelle Pfeiffer, Dakota Fanning, Dianne Wiest, Loretta Devine, Richard Schiff, Laura Dern, Brad Silverman, Joseph Rosenberg, Stanley DeSantis, Doug Hutchison",United States,2021-06-02,2001,PG-13,132 min,Dramas,"When the legal system declares him unfit to be a parent, a father with an intellectual disability fights to regain custody of his young daughter.",797,7.6,2021.0
s780,Movie,Battlefield Earth,Roger Christian,"John Travolta, Barry Pepper, Forest Whitaker, Kim Coates, Sabine Karsenti, Richard Tyson, Kelly Preston, Michael MacRae, Shaun Austin-Olsen, Tim Post, Michael Byrne",United States,2021-06-02,2000,PG-13,118 min,"Action & Adventure, Cult Movies, Sci-Fi & Fantasy","In the year 3000, an alien race known as the Psychlos devastate planet Earth and force the surviving human population into slavery.",779,2.5,2021.0
s781,TV Show,Ben & Holly's Little Kingdom,,"Preston Nyman, Sian Taylor, Ian Puleston-Davies, Sara Crowe, Sarah Ann Kennedy, Judy Flynn, John Sparkes, David Graham",United Kingdom,2021-06-02,2019,TV-Y,2 Seasons,Kids' TV,"In the magical Little Kingdom, friends Ben Elf and fairy princess Holly have fun adventures as they learn about teamwork, sharing and problem-solving.",780,7.4,2021.0
s782,Movie,Black Holes | The Edge of All We Know,Peter Galison,,,2021-06-02,2021,TV-14,99 min,Documentaries,Follow scientists on their quest to understand and capture the first image of a black hole while exploring the limits of our knowledge of the universe.,781,6.6,2021.0
s783,Movie,Bliss,Lance Young,"Craig Sheffer, Sheryl Lee, Terence Stamp, Casey Siemaszko, Spalding Gray, Lois Chiles, Blu Mankuma, Ken Camroux-Taylor, Eli Gabay, Molly Parker","Canada, United States",2021-06-02,1997,R,103 min,"Dramas, Romantic Movies","Two young newlyweds seek out the help of unlicensed sex therapist Baltazar, who initiates the couple into the mysteries of tantric sex.",782,5.4,2021.0
s784,Movie,Carnaval,Leandro Neri,"Giovana Cordeiro, Gkay, Bruna Inocencio, Samya Pascotto, Flavia Pavanelli, Micael Borges, Jean Pedro, Rafael Medrado, Nikolas Antunes, Stella Miranda",Brazil,2021-06-02,2021,TV-MA,95 min,"Comedies, International Movies, Music & Musicals","After a breakup, an influencer takes her friends on a free trip to Bahia's vibrant Carnival, where she learns life's not just about social media likes.",783,4.1,2021.0
s785,Movie,Cloudburst,Thom Fitzgerald,"Olympia Dukakis, Ryan Doucette, Brenda Fricker, Kristin Booth, Michael McPhee, John Dunsworth, Jeremy Akerman, Mary-Colin Chisholm, Kevin Kincaid","United States, Canada",2021-06-02,2011,TV-MA,93 min,"Comedies, Dramas, Independent Movies","A lesbian couple escapes from their nursing home and heads to Canada to get married. Along the way, they pick up a young male hitchhiker.",784,7.2,2021.0
s779,TV Show,Attack on Titan,,"Yuki Kaji, Yui Ishikawa, Marina Inoue, Kisho Taniyama, Yu Shimamura, Yu Kobayashi, Shiori Mikami, Hiro Shimono, Ryota Osaka, Yoshimasa Hosoya, Tomohisa Hashizume, Saki Fujita, Hiroshi Kamiya, Daisuke Ono, Romi Park, Keiji Fujiwara, Kazuhiro Yamaji, Yusaku Yara, Takehito Koyasu",Japan,2021-06-02,2013,TV-MA,1 Season,"Anime Series, International TV Shows","With his hometown in ruins, young Eren Yeager becomes determined to fight back against the giant Titans that threaten to destroy the human race.",778,9.1,2021.0
s787,Movie,Company of Heroes,Don Michael Paul,"Tom Sizemore, Chad Michael Collins, Vinnie Jones, Dimitri Diatchenko, Neal McDonough, Jürgen Prochnow, Sam Spruell, Richard Sammel, Philip Rham, Alastair Mackenzie",United States,2021-06-02,2013,R,101 min,"Action & Adventure, Dramas","During the last major German offensive of World War II, a group of Allied soldiers sets out against all odds to turn the war around.",786,5.0,2021.0
s788,Movie,Cradle 2 the Grave,Andrzej Bartkowiak,"Jet Li, DMX, Anthony Anderson, Kelly Hu, Tom Arnold, Mark Dacascos, Gabrielle Union, Michael Jace, Drag-On, Paige Hurd",United States,2021-06-02,2003,R,101 min,Action & Adventure,"When a jewel thief pulls off a risky diamond heist with his crew, a gang kidnaps his young daughter and steals the loot as a rival agent offers his help.",787,5.8,2021.0
s789,Movie,Domestic Disturbance,Harold Becker,"John Travolta, Vince Vaughn, Teri Polo, Matt O'Leary, Ruben Santiago-Hudson, Susan Floyd, Angelica Page, Steve Buscemi, Chris Ellis",United States,2021-06-02,2001,PG-13,89 min,Thrillers,A recovering alcoholic is skeptical of his son's claim that his new stepfather is a killer – but soon begins to sense the boy is telling the truth.,788,5.6,2021.0
s790,TV Show,Downton Abbey,,"Hugh Bonneville, Jessica Brown Findlay, Samantha Bond, Laura Carmichael, Jim Carter, Raquel Cassidy, Brendan Coyle, Tom Cullen, Michelle Dockery, Kevin Doyle, Siobhan Finneran, Michael Fox, Joanne Froggatt, Matthew Goode, Harry Hadden-Paton, Thomas Howes, Lily James, Rob James-Collier, Rose Leslie, Phyllis Logan, Elizabeth McGovern, Sophie McShera, Lesley Nicol, Maggie Smith, Penelope Wilton",United Kingdom,2021-06-02,2015,TV-14,6 Seasons,"British TV Shows, International TV Shows, TV Dramas","Exposing the snobbery and machinations of a vanishing class system, this series chronicles events in the lives of the Crawley family and their servants.",789,8.7,2021.0
s791,Movie,Dream/Killer,Andrew Jenks,"Bill Ferguson, Ryan Ferguson",United States,2021-06-02,2015,TV-MA,109 min,Documentaries,This riveting crime doc follows Bill as he confronts America's broken judicial system after his son is falsely sentenced to 40 years in prison.,790,4.8,2021.0
s792,Movie,Felon,Ric Roman Waugh,"Stephen Dorff, Val Kilmer, Harold Perrineau, Marisol Nichols, Anne Archer, Nick Chinlund, Nate Parker, Johnny Lewis, Sam Shepard, Jake Walker, Joey Villasenor, Antonio Leyba, Mike Seal, Richard Caruso, Kevin Wiggins, Larnell Stovall, Mara Holguin, Elton Walker, Brittany Perrineau, Esodie Geiger, Jermaine Washington, Greg Serano, Brian Keith Gamble, Mark Sivertsen, Carrie Fleming, Adam Taylor, Chris Browning, John Koyama, Shawn Prince, Christopher Dempsey, Cynthia Ruffin",United States,2021-06-02,2008,R,104 min,"Action & Adventure, Dramas","After killing a burglar while trying to protect his family, regular guy Wade is convicted of involuntary manslaughter and thrown into prison.",791,7.4,2021.0
s793,Movie,Flipped,Rob Reiner,"Madeline Carroll, Callan McAuliffe, Rebecca De Mornay, Anthony Edwards, John Mahoney, Penelope Ann Miller, Aidan Quinn, Kevin Weisman, Morgan Lily, Ryan Ketzner",United States,2021-06-02,2010,PG,90 min,"Comedies, Dramas, Romantic Movies","Bryce and Juli first meet as children, with Juli having a crush on Bryce. As they mature, it appears their bond may blossom into something more.",792,7.7,2021.0
s794,Movie,Fools Rush In,Andy Tennant,"Matthew Perry, Salma Hayek, Jon Tenney, Carlos Gómez, Tomas Milian, Siobhan Fallon Hogan, John Bennett Perry, Stanley DeSantis, Suzanne Snyder, Anne Betancourt, Jill Clayburgh",United States,2021-06-02,1997,PG-13,109 min,"Comedies, Romantic Movies","When a one-night stand results in a pregnancy, two strangers with opposite personalities rush into marriage then must deal with the consequences.",793,6.1,2021.0
s795,Movie,Gold Statue,Tade Ogidan,"Gabriel Afolayan, Kunle Remi, Richard Mofe-Damijo, Sola Sobowale, Kelvin Ikeduba, Kunle Fawole, Norbert Young, Alibaba Akporobome, Segun Arinze, Rycardo Agbor",Nigeria,2021-06-02,2019,TV-14,145 min,"Comedies, Dramas, International Movies","After tracing an artifact to his ancestry, a young man and his friend's search for a gilded statue lands them in a maximum-security prison.",794,6.8,2021.0
s796,TV Show,Happy Endings,,"Eliza Coupe, Elisha Cuthbert, Zachary Knighton, Adam Pally, Damon Wayans Jr., Casey Wilson",United States,2021-06-02,2012,TV-14,3 Seasons,TV Comedies,"After his fiancée, Alex, dumps him at the altar, Dave finds himself nursing a broken heart and battling her for custody of their quirky friends.",795,7.8,2021.0
s797,Movie,Hostel: Part III,Scott Spiegel,"Kip Pardue, Brian Hallisay, John Hensley, Sarah Habel, Chris Coy, Skyler Stone, Thomas Kretschmann, Zulay Henao, Nickola Shreli, Derrick Carr",United States,2021-06-02,2011,R,88 min,"Cult Movies, Horror Movies","In this installment in the popular horror franchise, a bachelor party in Las Vegas turns into a hellish bloodbath for all involved.",796,4.6,2021.0
s826,TV Show,Dirty John,,"Connie Britton, Eric Bana, Juno Temple, Julia Garner, Jean Smart, Keiko Agena, Jeff Perry, Kevin Zegers, Jake Abel",United States,2021-05-31,2020,TV-MA,2 Seasons,"Crime TV Shows, TV Dramas, TV Mysteries",Businesswoman Debra Newell's life unravels when she falls for the lies and manipulation of con man John Meehan. Based on the true-crime podcast.,825,7.3,2021.0
s827,Movie,Bo Burnham: Inside,Bo Burnham,Bo Burnham,United States,2021-05-30,2021,TV-MA,88 min,Stand-Up Comedy,"A new comedy special shot and performed by Bo Burnham, alone, over the course of the past year.",826,8.6,2021.0
s828,Movie,One Lagos Night,Ekene Som Mekwunye,"Frank Donga, Gold Ikponmwosa, Ali Nuhu, Eniola Badmus, Ogbolor, Genoveva Umeh, Gbubemi Ejeye, Ajayi Akorede, Serge Noujaim",,2021-05-29,2021,TV-14,103 min,"Comedies, International Movies","A desperate man attempts to burglarize the home of a wealthy woman, but finds himself face-to-face with a crew of armed robbers who have the same idea.",827,6.7,2021.0
s829,Movie,Collateral Beauty,David Frankel,"Will Smith, Edward Norton, Kate Winslet, Michael Peña, Helen Mirren, Naomie Harris, Keira Knightley, Jacob Latimore, Ann Dowd, Liza Colón-Zayas",United States,2021-05-28,2016,PG-13,97 min,Dramas,An advertising executive wrestling with grief finds meaning by writing letters to unconventional recipients as caring colleagues plot a ruse.,828,6.8,2021.0
s830,Movie,Dog Gone Trouble,Kevin Johnson,"Big Sean, Pamela Adlon, Lucy Hale, Marissa Jaret Winokur, Wilmer Valderrama, Joel McHale, Seth Rollins, Damon Wayans Jr., Olivia Holt, Carlos PenaVega",,2021-05-28,2021,TV-Y7,88 min,"Children & Family Movies, Comedies",The privileged life of a pampered dog named Trouble is turned upside-down when he gets lost and must learn to survive on the big-city streets.,829,5.8,2021.0
s831,TV Show,The Kominsky Method,,"Michael Douglas, Alan Arkin, Sarah Baker, Nancy Travis, Susan Sullivan, Lisa Edelstein, Emily Osment, Graham Rogers, Jenna Lyng Adams, Ashleigh LaThrop, Melissa Tang, Casey Thomas Brown, Ann-Margret, Danny DeVito",United States,2021-05-28,2021,TV-MA,3 Seasons,"TV Comedies, TV Dramas",Acting coach Sandy Kominsky and best friend Norman Newlander keep each other laughing as they navigate the ups and downs of getting older.,830,8.2,2021.0
s832,TV Show,The Least Expected Day: Inside the Movistar Team 2019,"José Larraza, Marc Pons",,,2021-05-28,2021,TV-MA,2 Seasons,"Docuseries, International TV Shows, Spanish-Language TV Shows","Pro cycling’s Movistar Team sets their sights on victory while on the road as they face challenges, controversy and internal conflict.",831,7.4,2021.0
s833,TV Show,Word of Honor,Gary Sing,"Zhang Zhehan, Gong Jun, Zhou Ye, Asher Ma, Sun Xilun, Chen Zihan, Rolling Wang, Zhang Yonggang, Li Daikun, Huang Youming, Damon Guo",,2021-05-28,2021,TV-14,1 Season,"International TV Shows, TV Action & Adventure, TV Dramas","A disillusioned royal magistrate sets out for the martial arts world, where he encounters a bosom friend and becomes entangled in a conspiracy.",832,8.4,2021.0
s834,TV Show,Black Space,,"Guri Alfi, Shai Avivi, Assi Levy, Reut Alush, Meirav Shirom, Yoav Rotman, Liana Ayoun, Noam Karmeli, Hadas Jade Sakori, Yehonatan Vilozny, Gily Itskovitch, Oneg Efron, Suzanna Papian, Ori Biton, Nir Hasdai, Leib Lev Levin, Eyal Shikratzi",Israel,2021-05-27,2021,TV-MA,1 Season,"Crime TV Shows, International TV Shows, TV Dramas",A rogue detective with unorthodox means leads an investigation into a massacre committed by unicorn mask-wearing assassins at an Israeli high school.,833,6.7,2021.0
s835,Movie,Blue Miracle,Julio Quintana,"Jimmy Gonzales, Dennis Quaid, Anthony Gonzalez, Bruce McGill, Raymond Cruz, Nathan Arenas, Miguel Angel Garcia, Isaac Arellanes, Steve Gutierrez, Dana Wheeler-Nicholson, Fernanda Urrejola, Silverio Palacios",United States,2021-05-27,2021,TV-PG,97 min,"Children & Family Movies, Dramas, Faith & Spirituality","To save their cash-strapped orphanage, a guardian and his kids partner with a washed-up boat captain for a chance to win a lucrative fishing competition.",834,6.6,2021.0
s837,Movie,Ghost Lab,Paween Purijitpanya,"Thanapob Leeratanakachorn, Paris Intarakomalyasut, Nuttanicha Dungwattanawanich, Suquan Bulakul, Rachanee Siralert, Chaleeda Gilbert, Nuttawut Jenmana, Alanta Potjes, Anchuleeon Buagaew, Jinjuta Rattanaburi",Thailand,2021-05-27,2021,TV-MA,118 min,"Horror Movies, International Movies, Thrillers","After witnessing a haunting in their hospital, two doctors become dangerously obsessed with obtaining scientific proof that ghosts exist.",836,5.2,2021.0
s838,TV Show,Ragnarok,,"David Stakston, Jonas Strand Gravli, Herman Tømmeraas, Theresa Frostad Eggesbø, Emma Bones, Henriette Steenstrup, Gísli Örn Garðarsson, Synnøve Macody Lund, Ylva Thedin Bjørkaas, Odd-Magnus Williamson","Norway, Denmark",2021-05-27,2021,TV-MA,2 Seasons,"International TV Shows, TV Action & Adventure, TV Dramas","In a Norwegian town poisoned by pollution and rattled by melting glaciers, the End Times feel all too real. It’ll take a legend to battle an old evil.",837,7.3,2021.0
s839,Movie,Soy Rada: Serendipity,Pablo Faro,Agustín Aristarán,Argentina,2021-05-27,2021,TV-MA,70 min,Stand-Up Comedy,"The delightful Argentine comic Agustín Aristarán (aka Soy Rada) is back, this time putting the spotlight on family and parenting, magic and music.",838,6.0,2021.0
s845,Movie,Nail Bomber: Manhunt,Daniel Vernon,,,2021-05-26,2021,TV-MA,73 min,"Documentaries, International Movies","This documentary examines the 1999 London bombings that targeted Black, Bangladeshi and gay communities, and the race to find the far-right perpetrator.",844,6.3,2021.0
s844,TV Show,JoJo's Bizarre Adventure,,"Kazuyuki Okitsu, Tomokazu Sugita, Daisuke Ono, Unsho Ishizuka, Kensho Ono, Takehito Koyasu, Yoku Shioya, Yoji Ueda, Ayako Kawasumi, Takuya Sato, Atsuko Tanaka, Atsushi Imaruoka, Daisuke Hirakawa, Fuminori Komatsu, Kenta Miyake, Misato Fukuen, Yuki Kaji, Wataru Takagi, Takahiro Sakurai, Yuichi Nakamura, Junichi Suwabe, Kohsuke Toriumi, Daiki Yamashita, Junya Enoki",Japan,2021-05-26,2016,TV-MA,3 Seasons,"Anime Series, International TV Shows",Multiple generations of the Joestar family – all with the same nickname – confront supernatural villains through a series of time periods.,843,8.5,2021.0
s842,Movie,Gatao - The Last Stray,Ray Jiang,"Cheng Jen-shuo, Nikki Hsieh, Jack Kao, Lung Shao-hua, Alan Kuo, Alex Ko, Huang Shang-ho, Gary Tang, Chang Zhang-xing, Panda Wu, Samuel Ku, Justin Sheng",,2021-05-26,2021,TV-MA,120 min,"Action & Adventure, Dramas, International Movies",Romance unexpectedly blossoms when a freelance photographer arrives late to her assignment at a full moon celebration thrown for a mob boss's newborn.,841,6.0,2021.0
s843,TV Show,High on the Hog: How African American Cuisine Transformed America,,,,2021-05-26,2021,TV-14,1 Season,Docuseries,"Black food is American food. Chef and writer Stephen Satterfield traces the delicious, moving throughlines from Africa to Texas in this docuseries.",842,7.7,2021.0
s841,Movie,Baggio: The Divine Ponytail,Letizia Lamartire,"Andrea Arcangeli, Valentina Bellè, Andrea Pennacchi, Antonio Zavatteri, Anna Ferruzzo, Riccardo Goretti, Thomas Trabacchi, Marc Clotet, Martufello",Italy,2021-05-26,2021,TV-MA,92 min,"Dramas, International Movies, Sports Movies","The story of Roberto Baggio, one of the best soccer players of all time, including his career highs, triumphs over injuries and discovery of Buddhism.",840,6.1,2021.0
s846,Movie,A Place in the Stars,Steve Gukas,"Gideon Okeke, Dejumo Lewis, Segun Arinze, Amaka Mgbor, Mathilda Obaseki, Yemi Blaque, Lantana Ahmed, Patrick Otoro, Femi Brach, Ladi Alpha",,2021-05-25,2014,TV-14,110 min,"Dramas, International Movies, Thrillers",A young lawyer who has information about counterfeit drug trafficking in Nigeria must choose between betraying his conscience or revealing the truth.,845,6.5,2021.0
s847,Movie,Home,Tim Johnson,"Jim Parsons, Rihanna, Steve Martin, Jennifer Lopez, Matt Jones, Brian Stepanek, April Lawrence",United States,2021-05-25,2015,PG,94 min,"Children & Family Movies, Comedies, Sci-Fi & Fantasy","When misfit alien Oh mistakenly sends a party invite to the entire galaxy, he goes on the run to avoid trouble and befriends spunky human girl Tip.",846,7.3,2021.0
s849,TV Show,Master of None,,"Aziz Ansari, Noël Wells, Eric Wareheim, Lena Waithe, Kelvin Yu, Fatima Ansari, Shoukath Ansari, Alessandra Mastronardi, Bobby Cannavale",United States,2021-05-23,2021,TV-MA,3 Seasons,"TV Comedies, TV Dramas",Dev tries to jump-start his acting career and elevate his dating game with help from his eclectic group of friends in this award-winning series.,848,8.2,2021.0
s850,Movie,Sam Smith: Love Goes - Live at Abbey Road Studios,,Sam Smith,,2021-05-22,2020,TV-G,61 min,"International Movies, Music & Musicals","Grammy-winning artist Sam Smith gives an intimate, soulful performance at the iconic Abbey Road Studios featuring songs from their third album and more.",849,7.5,2021.0
s856,TV Show,Jurassic World Camp Cretaceous,,"Paul-Mikél Williams, Jenna Ortega, Sean Giambrone, Kausar Mohammed, Ryan Potter, Raini Rodriguez, Jameela Jamil, Glen Powell",United States,2021-05-21,2021,TV-Y7,3 Seasons,"Kids' TV, TV Action & Adventure, TV Sci-Fi & Fantasy",Six teens invited to attend a state-of-the-art adventure camp on Isla Nublar must band together to survive when the dinosaurs break out of captivity.,855,7.5,2021.0
s857,Movie,Strain,Uduak-Obong Patrick,"Okey Uzoeshi, Angel Unigwe, Nifemi Lawal, Alex Usifo, Gloria Anozie-Young, Shushu Abubakar, Aproko Doctor",,2021-05-21,2020,TV-MA,107 min,"Dramas, International Movies","When his son is diagnosed with sickle cell disease, a man and his family struggle to face a new reality as they rediscover their shared love.",856,7.3,2021.0
s858,TV Show,The Neighbor,,"Quim Gutiérrez, Clara Lago, Adrián Pino, Catelina Sopelana",Spain,2021-05-21,2021,TV-MA,2 Seasons,"International TV Shows, Spanish-Language TV Shows, TV Comedies",Self-centered Javier's life gets a bit messy when he unexpectedly becomes a superhero – and his recent ex is tasked with uncovering his identity.,857,4.8,2021.0
s855,Movie,Creating an Army of the Dead,,,,2021-05-21,2021,TV-MA,29 min,Documentaries,"Zack Snyder and his ""Army of the Dead"" team dive into the film's wild stunts, groundbreaking effects and the evolution of the zombie genre.",854,6.5,2021.0
s854,Movie,Army of the Dead,Zack Snyder,"Dave Bautista, Ella Purnell, Omari Hardwick, Garret Dillahunt, Ana de la Reguera, Theo Rossi, Matthias Schweighöfer, Nora Arnezeder, Hiroyuki Sanada, Tig Notaro, Raúl Castillo, Huma Qureshi, Samantha Win, Richard Cetrone, Michael Cassidy",United States,2021-05-21,2021,R,148 min,"Action & Adventure, Horror Movies","After a zombie outbreak in Las Vegas, a group of mercenaries takes the ultimate gamble by venturing into the quarantine zone for the greatest heist ever.",853,5.8,2021.0
s851,Movie,99 Songs,Vishwesh Krishnamoorthy,"Ehan Bhat, Edilsy Vargas, Manisha Koirala, Lisa Ray, Tenzin Dalha, Warina Hussain, Ranjit Barot, Neel Tyagi, Rahul Ram, Diwakar Pundir",India,2021-05-21,2021,TV-14,131 min,"Dramas, International Movies, Music & Musicals","Challenged to compose 100 songs before he can marry the girl he loves, a tortured but passionate singer-songwriter embarks on a poignant musical journey.",850,6.5,2021.0
