show_id,type,title,director,cast,country,date_added,release_year,rating,duration,listed_in,description,Index,IMDB_Rating,year_added
s393,Movie,Django Unchained,Quentin Tarantino,"Jamie Foxx, Christoph Waltz, Leonardo DiCaprio, Kerry Washington, Samuel L. Jackson, Walton Goggins, Dennis Christopher, James Remar, David Steen, Dana Gourrier, Nichole Galicia, Laura Cayouette, Ato Essandoh, Sammi Rotibi, Escalante Lundy, Don Johnson",United States,2021-07-24,2012,R,165 min,"Action & Adventure, Dramas","Accompanied by a German bounty hunter, a freed slave named Django travels across America to free his wife from a sadistic plantation owner.",392,8.5,2021.0
s401,TV Show,Revelations: The Masters of the Universe: Revelation Aftershow,,"Kevin Smith, Tiffany Smith, Robert David, Sarah Michelle Gellar, Chris Wood, Liam Cunningham, Alan Oppenheimer, Lena Headey, Kevin Conroy, Henry Rollins, Jason Mewes, Stephen Root, Mark Hamill",,2021-07-23,2021,TV-PG,1 Season,"Anime Series, Stand-Up Comedy & Talk Shows",Take a behind-the-scenes look at “Masters of the Universe: Revelation” as showrunner Kevin Smith and others interview the cast about their iconic roles.,400,6.2,2021.0
s404,TV Show,The Movies That Made Us,,,United States,2021-07-23,2021,TV-MA,2 Seasons,Docuseries,"These blockbusters brought us together and gave us the time of our lives. Meet the actors, directors and industry insiders who made them happen.",403,7.6,2021.0
s403,Movie,The Last Letter From Your Lover,Augustine Frizzell,"Shailene Woodley, Felicity Jones, Callum Turner, Joe Alwyn, Nabhaan Rizwan, Ncuti Gatwa, Emma Appleton, Christian Brassington, Alice Orr-Ewing, Lee Knight, Zoe Boyle, Ben Cross, Diana Kent",United Kingdom,2021-07-23,2021,TV-MA,111 min,"Dramas, Romantic Movies","After finding a trove of love letters from 1965, a reporter sets out to solve the mystery of a secret affair — while embarking on a romance of her own.",402,6.7,2021.0
s402,TV Show,Sky Rojo,,"Verónica Sánchez, Miguel Ángel Silvestre, Asier Etxeandia, Lali Espósito, Yany Prado, Enric Auquer, Luis Zahera, Carmen Santamaría, Cecilia Gómez, Godeliv Van den Brandt, Penélope Guerrero, Luisa Vides, Niko Verona, Chema Ruiz",Spain,2021-07-23,2021,TV-MA,2 Seasons,"International TV Shows, Spanish-Language TV Shows, TV Action & Adventure",A fatal turn of events at a brothel sends three women haunted by their pasts on a wild run from their pimp and his henchmen.,401,6.6,2021.0
s399,Movie,Kingdom: Ashin of the North,Kim Seong-hun,"Gianna Jun, Park Byung-eun, Kim Si-a, Kim Roi-ha, Koo Kyo-hwan",,2021-07-23,2021,TV-MA,94 min,"Horror Movies, International Movies, Thrillers","Tragedy, betrayal and a mysterious discovery fuel a woman's vengeance for the loss of her tribe and family in this special episode of ""Kingdom.""",398,7.0,2021.0
s396,Movie,Bankrolled,Marcos Bucay,"Aldo Escalante, Ricardo Polanco, Natalia Téllez, Fabrizio Santini, SeoJu Park, María Chacón, Giuseppe Gamba, Sebastián Zurita",,2021-07-23,2021,TV-MA,97 min,"Comedies, International Movies",Two directionless millennial bros get high and pitch a bold new social justice app that raises millions. Then they have to come up with the app.,395,4.2,2021.0
s400,TV Show,Masters of the Universe: Revelation,,"Mark Hamill, Lena Headey, Chris Wood, Sarah Michelle Gellar, Liam Cunningham, Stephen Root, Diedrich Bader, Griffin Newman, Tiffany Smith, Henry Rollins, Alan Oppenheimer, Susan Eisenberg, Alicia Silverstone, Justin Long, Jason Mewes, Phil LaMarr, Tony Todd, Cree Summer, Kevin Michael Richardson, Kevin Conroy, Harley Quinn Smith",,2021-07-23,2021,TV-PG,1 Season,"TV Action & Adventure, TV Sci-Fi & Fantasy","After a calamitous battle fractures Eternia, Teela and an unlikely alliance must prevent the end of the Universe in this sequel to the ’80s classic.",399,5.6,2021.0
s398,TV Show,Feels Like Ishq,,"Radhika Madan, Amol Parashar, Rohit Saraf, Kajol Chugh, Tanya Maniktala, Mihir Ahuja, Simran Jehani, Sanjeeta Bhattacharya, Saba Azaad, Skand Thakur, Zayn Marie Khan, Neeraj Madhav",,2021-07-23,2021,TV-MA,1 Season,"International TV Shows, Romantic TV Shows, TV Comedies",Short films follow young adults as they navigate the gamut of emotions that come with finding romantic connection in unexpected places.,397,6.5,2021.0
s397,Movie,Blood Red Sky,Peter Thorwarth,"Peri Baumeister, Alexander Scheer, Kais Setti, Carl Koch, Gordon Brown, Roland Møller, Chidi Ajufo, Kai Ivo Baulitz, Graham McTavish, Dominic Purcell",,2021-07-23,2021,TV-MA,123 min,"Action & Adventure, Horror Movies, International Movies","When a group of terrorists hijacks an overnight transatlantic flight, a mysteriously ill woman must unleash a monstrous secret to protect her young son.",396,6.1,2021.0
s394,Movie,A Second Chance:  Rivals!,Clay Glen,"Emily Morris, Stella Shute, Eva Grados, India Colombi, Nina Pearce, Adam Tuominen, Carmel Johnson, Natasha Wanganeen, Elysia Markou, Alexander Lloyd, Amy Handley",Australia,2021-07-23,2021,PG,91 min,"Children & Family Movies, Sports Movies","Crushed when she doesn't qualify for the Olympics, a now-grown Maddy Cornell finds new purpose coaching young gymnasts going up against a rival team.",393,4.8,2021.0
s424,Movie,Chhota Bheem: Master of Shaolin,Rajiv Chilaka,"Pooja Punabi, Mausam, Julie Tejwani, Rupa Bhimani, Jigna Bhardwaj, Rajesh Kava, Parigna Pandya",,2021-07-22,2011,TV-Y7,74 min,Children & Family Movies,"Summoned by a monk to help reclaim a temple from a dangerous leader, Bheem must master the Shaolin kung fu techniques if he wants a fighting chance!",423,6.7,2021.0
s419,Movie,Chhota Bheem Ka Roosi Romanch,"Arpan Sarkar, Shyamal Chaulia","Julie Tejwani, Sabina Malik, Jigna Bharadwaj, Rupa Bhimani, Lalit Agarwal, Rajesh Shukla, Disha, Rajesh Kava, Raju",,2021-07-22,2019,TV-Y,63 min,Children & Family Movies,"A faulty transportation machine lands Chhota Bheem and his friends in Russia, where they must save a princess from an evil, power-hungry magician.",418,8.6,2021.0
s420,Movie,Chhota Bheem: Bheem vs Aliens,Rajiv Chilaka,"Vatsal Dubey, Julie Tejwani, Rupa Bhimani, Jigna Bhardwaj, Rajesh Kava, Mousam, Swapnil",,2021-07-22,2010,TV-Y7,69 min,"Children & Family Movies, Sports Movies",Space invaders have kidnapped Dholakpur’s king and princess! The only way Bheem can rescue them? Defeat the aliens in a cricket match.,419,8.0,2021.0
s421,Movie,Chhota Bheem: Dholakpur to Kathmandu,Rajiv Chilaka,"Vatsal Dubey, Julie Tejwani, Rupa Bhimani, Jigna Bhardwaj, Rajesh Kava, Mousam, Swapnil",,2021-07-22,2012,TV-Y7,70 min,Children & Family Movies,Bheem’s holiday in Nepal takes an unexpected turn when he is called on to save a monkey cub from snow leopards and reunite him with his father.,420,9.5,2021.0
s423,Movie,Chhota Bheem: Journey to Petra,Rajiv Chilaka,"Vatsal Dubey, Julie Tejwani, Rupa Bhimani, Jigna Bhardwaj, Rajesh Kava",,2021-07-22,2011,TV-Y7,68 min,Children & Family Movies,"The king has been away to meet an old friend, but when he sends for urgent help, Bheem finds himself on an action-packed rescue mission to Egypt!",422,8.3,2021.0
s417,Movie,Chhota Bheem aur Krishna vs Zimbara,Rajiv Chilaka,"Vatsal Dubey, Julie Tejwani, Rupa Bhimani, Jigna Bhardwaj, Rajesh Kava, Mousam, Swapnil",,2021-07-22,2013,TV-Y7,64 min,Children & Family Movies,"A demon of darkness is plotting world domination — but when Bheem and Krishna catch wind of his plans, they’ll stop at nothing to destroy him.",416,7.5,2021.0
s425,Movie,Chhota Bheem: The Rise of Kirmada,Rajiv Chilaka,"Vatsal Dubey, Julie Tejwani, Rupa Bhimani, Jigna Bhardwaj, Rajesh Kava, Mousam, Swapnil",,2021-07-22,2012,TV-Y7,68 min,Children & Family Movies,Bheem and young lord Krishna team up to protect the world against the wicked and powerful Kirmada and his equally dangerous bat army.,424,7.3,2021.0
s426,TV Show,Chicago Med,,"Colin Donnell, Torrey DeVitto, Oliver Platt, S. Epatha Merkerson, Nick Gehlfuss, Yaya DaCosta, Laurie Holden",United States,2021-07-22,2019,TV-14,5 Seasons,TV Dramas,"The doctors and nurses of Gaffney Chicago Medical Center juggle the busy ER's dramas and dangers in this spinoff of ""Chicago Fire"" and ""Chicago P.D.""",425,7.6,2021.0
s427,Movie,Cousins,"Ainsley Gardiner, Briar Grace-Smith","Rachel House, Briar Grace-Smith, Tanea Heke, Tioreore Ngatai-Melbourne, Ana Scotney, Hariata Moriarty, Chelsie Preston Crayford, Sylvia Rands",New Zealand,2021-07-22,2021,TV-MA,99 min,Dramas,"Separated as children, three cousins with an unshakeable bond confront their painful pasts and embark on an emotional journey to find each other.",426,6.3,2021.0
s428,Movie,Wannabe Courageous,Mahmoud Karim,"Ramez Galal, Jamila Awad, Bayoumi Fouad, Mohamed Abdel-Rahman, Mohammed Tharwat, Maha Abou Ouf, Noor Kadri, Elshahat Mabrouk, Badriyyah Tulbah, Taher Abu Lela, Sara Derzawy",,2021-07-22,2019,TV-14,90 min,"Comedies, International Movies","When his newlywed wife becomes disenchanted because he failed to protect her from danger, Omar seeks the help of a quirky psychiatrist to win her back.",427,5.5,2021.0
s418,Movie,Chhota Bheem in African Safari,Binayak Das,"Sonal Kaushal, Rupa Bhimani, Julie Tejwani, Sabina Malik, Jigna Bharadwaj, Rajesh Kava",,2021-07-22,2015,TV-Y7,62 min,Children & Family Movies,Bheem’s plans for an exciting African safari are interrupted when he finds that an evil ruler is using magical powers to cause drought through the land.,417,8.1,2021.0
s422,Movie,Chhota Bheem: Dus Pe Dus,"Rajiv Chilaka, Owll Mina","Vatsal Dubey, Julie Tejwani, Rupa Bhimani, Jigna Bhardwaj, Rajesh Kava, Mousam, Swapnil",,2021-07-22,2014,TV-Y7,63 min,Children & Family Movies,"After a precious temple stone is stolen under his watch, Bheem trains in a special martial art to prepare for a showdown with the thief.",421,7.0,2021.0
s416,Movie,Chhota Bheem aur Krishna,Rajiv Chilaka,"Vatsal Dubey, Julie Tejwani, Rupa Bhimani, Jigna Bhardwaj, Rajesh Kava, Arun Shekher, Sanchit Wartak",India,2021-07-22,2009,TV-Y7,68 min,Children & Family Movies,"Centuries after the end of a conqueror's rule, he is mysteriously back from the dead. It’s up to Bheem to save Dholakpur from being taken over!",415,7.0,2021.0
s410,Movie,Chhota Bheem & Krishna: Pataliputra- City of the Dead,Rajiv Chilaka,"Vatsal Dubey, Julie Tejwani, Rupa Bhimani, Jigna Bhardwaj, Rajesh Kava, Arun Shekher, Sanchit Wartak",,2021-07-22,2010,TV-Y7,66 min,Children & Family Movies,Krishna needs Bheem’s help: The ruined city of Pataliputra has been cursed! Can the friends do what it takes to bring light back into this town?,409,8.8,2021.0
s406,Movie,Chhota Bheem - Dinosaur World,Sidheswar Shukla,"Sonal Kaushal, Rupa Bhimani, Julie Tejwani, Sabina Malik, Jigna Bharadwaj",,2021-07-22,2015,TV-Y,65 min,Children & Family Movies,"When a scientist has trouble caring for his secret baby dinosaur, he takes Bheem and friends back in time to return the pet to its natural habitat.",405,8.0,2021.0
s415,Movie,Chhota Bheem Aur Hanuman,Rajiv Chilaka,"Vatsal Dubey, Julie Tejwani, Rupa Bhimani, Jigna Bhardwaj, Rajesh Kava, Mousam, Swapnil",,2021-07-22,2012,TV-Y7,68 min,Children & Family Movies,"When two evil entities kidnap a princess in a plot to build a new kingdom, Bheem takes them on with the help of the courageous monkey god Hanuman.",414,7.9,2021.0
s408,Movie,Chhota Bheem & Ganesh,Rajiv Chilaka,"Vatsal Dubey, Julie Tejwani, Rupa Bhimani, Jigna Bhardwaj, Rajesh Kava, Mousam, Swapnil",,2021-07-22,2009,TV-Y7,68 min,Children & Family Movies,"Bheem and Lord Ganesha join forces to save Dholakpur from fire-spitting dragons, who have also captured Ganesh’s mouse companion!",407,8.2,2021.0
s409,Movie,Chhota Bheem & Krishna: Mayanagari,Rajiv Chilaka,"Vatsal Dubey, Julie Tejwani, Rupa Bhimani, Jigna Bhardwaj, Rajesh Kava, Mousam, Swapnil",,2021-07-22,2011,TV-Y7,67 min,Children & Family Movies,Young lord Krishna has fallen for demoness Maayandri’s revenge plot against him! Can Bheem rescue him and thwart Maayandri’s other destructive plans?,408,7.0,2021.0
s407,Movie,Chhota Bheem - Neeli Pahaadi,Rajiv Chilaka,"Vatsal Dubey, Julie Tejwani, Rupa Bhimani, Jigna Bhardwaj, Rajesh Kava, Mousam, Swapnil",,2021-07-22,2013,TV-Y7,64 min,Children & Family Movies,"Things get spooky when Bheem and his buddies travel to the border of Dholakpur, known for its eerie history and rumored to be haunted.",406,8.5,2021.0
s411,Movie,Chhota Bheem And The Broken Amulet,Rajiv Chilaka,"Vatsal Dubey, Julie Tejwani, Rupa Bhimani, Jigna Bhardwaj, Rajesh Kava, Mousam, Swapnil",India,2021-07-22,2013,TV-Y7,64 min,Children & Family Movies,"When a stranger tries to steal an amulet from the palace, Bheem learns the sad story behind the ornament and heads to Africa to defeat the real villain.",410,7.7,2021.0
s405,Movie,9to5: The Story of a Movement,,,,2021-07-22,2021,TV-MA,85 min,Documentaries,"In this documentary, female office workers in '70s Boston inspire change with a call for better pay, more opportunities and an end to sexual harassment.",404,7.4,2021.0
s412,Movie,Chhota Bheem And The Crown of Valhalla,Rajiv Chilaka,"Vatsal Dubey, Julie Tejwani, Rupa Bhimani, Jigna Bhardwaj, Rajesh Kava, Mousam, Swapnil",,2021-07-22,2013,TV-Y7,64 min,Children & Family Movies,"To save the kingdom of Valhalla from invasion by Vikings, Bheem is gathering his army of friends, who are ready to put up a formidable fight!",411,6.5,2021.0
s413,Movie,Chhota Bheem and the Incan Adventure,Rajiv Chilaka,"Vatsal Dubey, Julie Tejwani, Rupa Bhimani, Jigna Bhardwaj, Rajesh Kava, Mousam, Swapnil",,2021-07-22,2013,TV-Y7,65 min,Children & Family Movies,"When Dholakpur’s princess is kidnapped, Bheem is off to the land of the Incas to save her, but he’s in for an even bigger challenge upon his arrival.",412,8.1,2021.0
s414,Movie,Chhota Bheem and The ShiNobi Secret,Rajiv Chilaka,"Vatsal Dubey, Julie Tejwani, Rupa Bhimani, Jigna Bhardwaj, Rajesh Kava, Mousam, Swapnil",,2021-07-22,2013,TV-Y7,64 min,Children & Family Movies,"After learning of a samurai village under threat by their own emperor, Bheem sets off for Japan to offer his help.",413,8.4,2021.0
s430,Movie,Sanitation Day,Seyi Babatope,"Blossom Chukwujekwu, Elozonam Ogbolu, Nse Ikpe-Etim, Belinda Effah, Saeed Mohammed, Chukwuemeka Okoroafor, Kunle Fawole, Chris Okagbue, Adebayo Salami, Charles Inojie, Elvina Ibru, Tobi Bakare",Nigeria,2021-07-21,2020,TV-14,105 min,"Dramas, International Movies, Thrillers",Two cops must contend with the uncooperative tenants of an apartment complex as they try to solve a murder before the crime scene is wiped clean.,429,4.0,2021.0
s431,TV Show,Sexy Beasts,,,,2021-07-21,2021,TV-14,1 Season,"British TV Shows, International TV Shows, Reality TV","Hoping to say goodbye to superficial dating, real-life singles sport elaborate makeup and prosthetics to put true blind-date chemistry to the test.",430,4.7,2021.0
s432,TV Show,Too Hot to Handle: Brazil,,Bruna Louise,,2021-07-21,2021,TV-MA,1 Season,"International TV Shows, Reality TV, Romantic TV Shows","Sizzling hot young Brazilians meet at a dreamy beach resort. But for a shot at R$500,000 in this fun reality show, they'll have to give up sex.",431,4.8,2021.0
s433,Movie,Trollhunters: Rise of the Titans,"Johane Matte, Andrew L. Schmidt, Francisco Ruiz Velasco","Emile Hirsch, Lexi Medrano, Charlie Saxton, Kelsey Grammer, Fred Tatasciore, Steven Yeun, Cole Sand, Amy Landecker, Jonathan Hyde, Thomas F. Wilson, Lauren Tom, Diego Luna, Tatiana Maslany, Nick Offerman, Nick Frost, Colin O'Donoghue, Alfred Molina, Piotr Michael, Kay Bess, Angel Lin, James Hong",,2021-07-21,2021,TV-Y7,106 min,Children & Family Movies,"Heroes from ""Trollhunters,"" ""3Below"" and ""Wizards"" join forces to fight a shadowy enemy threatening to take over their worlds — and reset Earth itself.",432,6.6,2021.0
s434,Movie,Milkwater,Morgan Ingari,"Molly Bernard, Patrick Breen, Robin de Jesús, Ava Eisenson, Ade Otukoya",United States,2021-07-20,2020,TV-MA,102 min,"Comedies, Dramas, Independent Movies",Aimless 20-something Milo impulsively becomes a gay man’s surrogate and wrestles with the emotional complexities of her non-traditional decision.,433,6.2,2021.0
s435,TV Show,Okupas,,"Rodrigo de la Serna, Diego Alonso, Ariel Staltari, Franco Tirri, Ana Celentano, Rosina Soto, Augusto Brítez, Dante Mastropierro, Susana Manchini, Diana Wells",Argentina,2021-07-20,2020,TV-MA,1 Season,"Classic & Cult TV, Crime TV Shows, International TV Shows","In 2000, a group of young men takes over a house in Buenos Aires, becoming squatters, while dealing with an increasingly violent and hostile city.",434,8.9,2021.0
s436,TV Show,Touch Your Heart,,"Lee Dong-wook, Yoo In-na, Lee Sang-woo, Son Sung-yoon, Oh Jung-se, Shim Hyoung-tak, Jang So-yeon, Park Ji-hwan, Lee Jun-hyuk",,2021-07-20,2019,TV-MA,1 Season,"Crime TV Shows, International TV Shows, Romantic TV Shows","Hoping to make a comeback after a bad scandal, an actress agrees to research a new role by taking a job as a secretary for a prickly attorney.",435,7.6,2021.0
s437,Movie,The Tambour of Retribution,Abdulaziz Alshlahei,"Faisal Al Dokhei, Adwa Fahad, Muhand Alsaleh, Rawya Ahmed, Ajeba Aldosary, Aly Ibrahim, Samer Elkhal, Hashem Hawsawi, Ibrahim Mesisebi, Shabib Alkhaleefa, Abdulateif Saud, Nada Alshehry, Dhay Nasser",Saudi Arabia,2021-07-19,2021,TV-14,91 min,"Dramas, International Movies, Romantic Movies","In an impoverished neighborhood, the son of a swordsman falls in love with the daughter of a wedding singer — a taboo match in a traditional society.",436,6.8,2021.0
s438,Movie,Cosmic Sin,Edward Drake,"Frank Grillo, Bruce Willis, Brandon Thomas Lee, Corey Large, Perrey Reeves, C.J. Perry, Lochlyn Munro, Costas Mandylor, Adelaide Kane, Eva De Dominici, Sarah May Sommers, Trevor Gretzky",United States,2021-07-17,2021,R,88 min,Action & Adventure,"In the year 2524, a disgraced retired general is called back into combat to help prevent an interstellar war against a hostile alien fleet.",437,2.5,2021.0
s439,Movie,2 Weeks in Lagos,Kathryn Fasegha,"Beverly Naya, Mawuli Gavor, Ajoke Silva, Jide Kosoko, Toyin Abraham, Okey Uzoeshi, Deyemi Okanlawon, Shaffy Bello, Tina Mba, Efe Irele",,2021-07-16,2020,TV-PG,107 min,"Dramas, International Movies, Romantic Movies",A businessman returns home to Nigeria and falls in love with a friend's sister despite his family’s plan for him to marry a politician’s daughter.,438,6.0,2021.0
s447,Movie,The Book of Henry,Colin Trevorrow,"Naomi Watts, Jaeden Martell, Jacob Tremblay, Sarah Silverman, Dean Norris, Lee Pace, Maddie Ziegler, Tonya Pinkins, Bobby Moynihan, Geraldine Hughes",United States,2021-07-16,2017,PG-13,105 min,Dramas,"An 11-year-old vows to help a new neighbor who he suspects is in danger, and documents his efforts in a series of written entries and audio recordings.",446,6.6,2021.0
s452,Movie,Twilight,Catherine Hardwicke,"Kristen Stewart, Robert Pattinson, Billy Burke, Peter Facinelli, Elizabeth Reaser, Cam Gigandet, Ashley Greene, Anna Kendrick, Nikki Reed, Taylor Lautner, Jackson Rathbone, Kellan Lutz",United States,2021-07-16,2008,PG-13,122 min,"Action & Adventure, Dramas, Romantic Movies","When Bella Swan moves in with her father, she starts school and meets Edward, a mysterious classmate who reveals himself to be a 108-year-old vampire.",451,5.3,2021.0
s451,Movie,The Twilight Saga: New Moon,Chris Weitz,"Kristen Stewart, Robert Pattinson, Taylor Lautner, Ashley Greene, Rachelle Lefevre, Billy Burke, Michael Sheen, Dakota Fanning, Peter Facinelli, Elizabeth Reaser, Jackson Rathbone, Kellan Lutz, Nikki Reed, Edi Gathegi",United States,2021-07-16,2009,PG-13,131 min,"Dramas, Romantic Movies","Still reeling from the departure of vampire Edward Cullen, a heartbroken Bella Swan finds comfort in her friendship with werewolf Jacob Black.",450,4.8,2021.0
s450,Movie,The Twilight Saga: Eclipse,David Slade,"Kristen Stewart, Robert Pattinson, Taylor Lautner, Bryce Dallas Howard, Billy Burke, Dakota Fanning, Peter Facinelli, Elizabeth Reaser, Jackson Rathbone, Kellan Lutz, Ashley Greene, Nikki Reed",United States,2021-07-16,2010,PG-13,124 min,"Dramas, Romantic Movies","With a bloodthirsty enemy on a quest for revenge, Bella must reconcile her love for vampire Edward and her growing feelings for werewolf Jacob.",449,5.1,2021.0
s449,Movie,The Twilight Saga: Breaking Dawn: Part 2,Bill Condon,"Kristen Stewart, Robert Pattinson, Taylor Lautner, Peter Facinelli, Elizabeth Reaser, Ashley Greene, Jackson Rathbone, Kellan Lutz, Nikki Reed, Billy Burke",United States,2021-07-16,2012,PG-13,115 min,"Dramas, Romantic Movies","In the epic series' final chapter, Bella and Edward's newborn daughter forces the couple into a life-altering confrontation with the Volturi.",448,5.5,2021.0
s440,Movie,Deep,"Sita Likitvanichkul, Jetarin Ratanaserikiat, Apirak Samudkitpaisan, Thanabodee Uawithya, Adirek Wattaleela","Panisara Rikulsurakan, Kay Lertsittichai, Supanaree Sutavijitvong, Krit Jeerapattananuwong, Warisara Jitpreedasakul, Dujdao Vadhanapakorn, Kim Waddoup, Philaiwan Khamphirathat, Wongsakorn Rassamitat, Bhumibhat Thavornsiri",Thailand,2021-07-16,2021,TV-MA,101 min,"Dramas, International Movies, Thrillers",Four insomniac med school students are lured into a neuroscience experiment that spirals out of control — and must find a way out before it’s too late.,439,5.5,2021.0
s448,Movie,The Twilight Saga: Breaking Dawn: Part 1,Bill Condon,"Kristen Stewart, Robert Pattinson, Taylor Lautner, Billy Burke, Peter Facinelli, Elizabeth Reaser, Kellan Lutz, Nikki Reed, Jackson Rathbone, Ashley Greene",United States,2021-07-16,2011,PG-13,117 min,"Dramas, Romantic Movies","After a dream wedding, Bella and Edward enter a new nightmare when a shocking development forces life-or-death decisions.",447,4.9,2021.0
s446,Movie,The Beguiled,Sofia Coppola,"Colin Farrell, Nicole Kidman, Kirsten Dunst, Elle Fanning, Oona Laurence, Angourie Rice, Addison Riecke, Emma Howard",United States,2021-07-16,2017,R,94 min,"Dramas, Independent Movies, Thrillers","During the Civil War, a wounded Union soldier takes refuge at a Southern girls school, rupturing the calm amid growing sexual tension and infighting.",445,6.3,2021.0
s445,TV Show,Naomi Osaka,Garrett Bradley,,,2021-07-16,2021,TV-14,1 Season,Docuseries,This intimate series follows Naomi Osaka as she explores her cultural roots and navigates her multifaceted identity as a tennis champ and rising leader.,444,6.3,2021.0
s444,Movie,La ley de Herodes,Luis Estrada,"Damián Alcázar, Pedro Armendáriz Jr., Delia Casanova, Juan Carlos Colombo, Alex Cox, Guillermo Gil, Ernesto Gómez Cruz, Leticia Huijara, Luis de Icaza, Eduardo López Rojas, Manuel Ojeda, Salvador Sánchez, Evangelina Sosa, Isela Vega",,2021-07-16,1999,R,123 min,"Comedies, International Movies","Following the brutal 1949 murder of a small Mexican town's mayor, genteel and humble janitor Juan Vargas is appointed his successor.",443,7.8,2021.0
s443,TV Show,Johnny Test,,"James Arnold Taylor, Trevor Devall, Maryke Hendrikse, Emily Tennant","United States, Canada",2021-07-16,2021,TV-Y7,1 Season,"Kids' TV, TV Comedies","How much trouble could one imaginative boy, his faithful dog and two science-loving sisters possibly get into? Hmm, that sounds like a challenge!",442,5.2,2021.0
s442,Movie,Fear Street Part 3: 1666,Leigh Janiak,"Kiana Madeira, Ashley Zukerman, Gillian Jacobs, Olivia Scott Welch, Benjamin Flores Jr., Darrell Britt-Gibson, Sadie Sink, Emily Rudd, McCabe Slye, Julia Rehwald, Fred Hechinger, Jordana Spiro, Jordyn DiNatale",,2021-07-16,2021,R,114 min,"Horror Movies, LGBTQ Movies","Thrust back to 1666, Deena learns the truth about Sarah Fier. Back in 1994, the friends fight for their lives — and Shadyside’s future.",441,6.6,2021.0
s441,TV Show,Explained,,,United States,2021-07-16,2021,TV-MA,3 Seasons,"Docuseries, Science & Nature TV","This enlightening series from Vox digs into a wide range of topics such as the rise of cryptocurrency, why diets fail, and the wild world of K-pop.",440,8.0,2021.0
s463,Movie,This Changes Everything,Tom Donahue,,United States,2021-07-15,2019,TV-MA,96 min,Documentaries,This documentary takes a deep look at gender disparity in Hollywood through the eyes of well-known actresses and female filmmakers.,462,7.7,2021.0
s462,Movie,The Unknown Saint,Alaa Eddine Aljem,"Younes Bouab, Salah Bensalah, Bouchaib Essamak, Mohamed Naimane, Anas Elbaz, Hassan Ben Badida, Abdelghani Kitab, Ahmed Yarziz, Rachid El Adouani, Mohamed El Moutamassik, Abdel Ghani Benizza, Adam Morjany",,2021-07-15,2019,TV-14,100 min,"Comedies, Dramas, Independent Movies","Following a stint behind bars, a thief returns to where he buried his loot, only to find that his hiding spot is now a shrine to an unknown saint.",461,6.5,2021.0
s461,Movie,Surf's Up,"Ash Brannon, Chris Buck","Shia LaBeouf, Jeff Bridges, Zooey Deschanel, Jon Heder, James Woods, Diedrich Bader, Mario Cantone, Kelly Slater, Rob Machado, Sal Masekela","United States, Canada",2021-07-15,2007,PG,86 min,"Children & Family Movies, Comedies, Sports Movies",This Oscar-nominated animated comedy goes behind the scenes at the Penguin World Surfing Championship to get a close-up look at the inventors of surfing.,460,6.7,2021.0
s460,TV Show,Never Have I Ever,,"Maitreyi Ramakrishnan, Poorna Jagannathan, Richa Moorjani, Jaren Lewison, Darren Barnet, John McEnroe, Ramona Young, Lee Rodriguez, Sendhil Ramamurthy, Adam Shapiro, Niecy Nash, Cocoa Brown, Lily D. Moore, Eddie Liu",United States,2021-07-15,2021,TV-14,2 Seasons,"TV Comedies, TV Dramas, Teen TV Shows","After a traumatic year, all an Indian-American teen wants is to go from pariah to popular — but friends, family and feelings won’t make it easy on her.",459,7.8,2021.0
s459,Movie,My Amanda,Alessandra de Rossi,"Piolo Pascual, Alessandra de Rossi, KC Montero, Alex Medina, Jess Mendoza, Helga Krapf, Joyce Ann Burton, Luz Valdez",,2021-07-15,2021,TV-14,90 min,"Dramas, International Movies, Romantic Movies","Two unusually close friends share every aspect of their lives together. As their lives evolve, their bond remains the only constant.",458,5.8,2021.0
