show_id,type,title,director,cast,country,date_added,release_year,rating,duration,listed_in,description,Index,IMDB_Rating,year_added
s1,Movie,Dick Johnson Is Dead,Kirsten Johnson,,United States,2021-09-25,2020,PG-13,90 min,Documentaries,"As her father nears the end of his life, filmmaker Kirsten Johnson stages his death in inventive and comical ways to help them both face the inevitable.",0,7.4,2021.0
s7,Movie,My Little Pony: A New Generation,"Robert Cullen, José Luis Ucha","Vanessa Hudgens, Kimiko Glenn, James Marsden, Sofia Carson, Liza Koshy, Ken Jeong, Elizabeth Perkins, Jane Krakowski, Michael McKean, Phil LaMarr",,2021-09-24,2021,PG,91 min,Children & Family Movies,"Equestria's divided. But a bright-eyed hero believes Earth Ponies, Pegasi and Unicorns should be pals — and, hoof to heart, she’s determined to prove it.",6,6.8,2021.0
s11,TV Show,"Vendetta: Truth, Lies and The Mafia",,,,2021-09-24,2021,TV-MA,1 Season,"Crime TV Shows, Docuseries, International TV Shows","Sicily boasts a bold ""Anti-Mafia"" coalition. But what happens when those trying to bring down organized crime are accused of being criminals themselves?",10,6.7,2021.0
s10,Movie,The Starling,Theodore Melfi,"Melissa McCarthy, Chris O'Dowd, Kevin Kline, Timothy Olyphant, Daveed Diggs, Skyler Gisondo, Laura Harrier, Rosalind Chao, Kimberly Quinn, Loretta Devine, Ravi Kapoor",United States,2021-09-24,2021,PG-13,104 min,"Comedies, Dramas",A woman adjusting to life after a loss contends with a feisty bird that's taken over her garden — and a husband who's struggling to find a way forward.,9,6.4,2021.0
s9,TV Show,The Great British Baking Show,Andy Devonshire,"Mel Giedroyc, Sue Perkins, Mary Berry, Paul Hollywood",United Kingdom,2021-09-24,2021,TV-14,9 Seasons,"British TV Shows, Reality TV","A talented batch of amateur bakers face off in a 10-week competition, whipping up their best dishes in the hopes of being named the U.K.'s best.",8,8.1,2021.0
s8,Movie,Sankofa,Haile Gerima,"Kofi Ghanaba, Oyafunmike Ogunlano, Alexandra Duah, Nick Medley, Mutabaruka, Afemo Omilami, Reggie Carter, Mzuri","United States, Ghana, Burkina Faso, United Kingdom, Germany, Ethiopia",2021-09-24,1993,TV-MA,125 min,"Dramas, Independent Movies, International Movies","On a photo shoot in Ghana, an American model slips back in time, becomes enslaved on a plantation and bears witness to the agony of her ancestral past.",7,7.0,2021.0
s2,TV Show,Blood & Water,,"Ama Qamata, Khosi Ngema, Gail Mabalane, Thabang Molaba, Dillon Windvogel, Natasha Thahane, Arno Greeff, Xolile Tshabalala, Getmore Sithole, Cindy Mahlangu, Ryle De Morny, Greteli Fincham, Sello Maake Ka-Ncube, Odwa Gwanya, Mekaila Mathys, Sandi Schultz, Duane Williams, Shamilla Miller, Patrick Mofokeng",South Africa,2021-09-24,2021,TV-MA,2 Seasons,"International TV Shows, TV Dramas, TV Mysteries","After crossing paths at a party, a Cape Town teen sets out to prove whether a private-school swimming star is her sister who was abducted at birth.",1,6.7,2021.0
s6,TV Show,Midnight Mass,Mike Flanagan,"Kate Siegel, Zach Gilford, Hamish Linklater, Henry Thomas, Kristin Lehman, Samantha Sloyan, Igby Rigney, Rahul Kohli, Annarah Cymone, Annabeth Gish, Alex Essoe, Rahul Abburi, Matt Biedel, Michael Trucco, Crystal Balint, Louis Oliver",,2021-09-24,2021,TV-MA,1 Season,"TV Dramas, TV Horror, TV Mysteries","The arrival of a charismatic young priest brings glorious miracles, ominous mysteries and renewed religious fervor to a dying town desperate to believe.",5,7.7,2021.0
s4,TV Show,Jailbirds New Orleans,,,,2021-09-24,2021,TV-MA,1 Season,"Docuseries, Reality TV","Feuds, flirtations and toilet talk go down among the incarcerated women at the Orleans Justice Center in New Orleans on this gritty reality series.",3,6.5,2021.0
s3,TV Show,Ganglands,Julien Leclercq,"Sami Bouajila, Tracy Gotoas, Samuel Jouy, Nabiha Akkari, Sofia Lesaffre, Salim Kechiouche, Noureddine Farihi, Geert Van Rampelberg, Bakary Diombera",,2021-09-24,2021,TV-MA,1 Season,"Crime TV Shows, International TV Shows, TV Action & Adventure","To protect his family from a powerful drug lord, skilled thief Mehdi and his expert team of robbers are pulled into a violent and deadly turf war.",2,7.2,2021.0
s5,TV Show,Kota Factory,,"Mayur More, Jitendra Kumar, Ranjan Raj, Alam Khan, Ahsaas Channa, Revathi Pillai, Urvi Singh, Arun Kumar",India,2021-09-24,2021,TV-MA,2 Seasons,"International TV Shows, Romantic TV Shows, TV Comedies","In a city of coaching centers known to train India’s finest collegiate minds, an earnest but unexceptional student and his friends navigate campus life.",4,9.0,2021.0
s12,TV Show,Bangkok Breaking,Kongkiat Komesiri,"Sukollawat Kanarot, Sushar Manaying, Pavarit Mongkolpisit, Sahajak Boonthanakit, Suthipongse Thatphithakkul, Bhasaworn Bawronkirati, Daweerit Chullasapya, Waratthaya Wongchayaporn, Kittiphoom Wongpentak, Abhicha Thanachanun, Nophand Boonyai, Kittipong Khamsat, Arisara Wongchalee, Jaytiya Naiwattanakul, Pantipa Arunwattanachai, Panupan Jantanawong, Kungtap Saelim, Phumphat Chartsuriyakiat, Issara Veranitinunt, Keerati Sivakuae, Panjai Sirisuwan, Supranee Charoenpol, Suda Chuenban, Visaka Banhansupavat, Pitchatorn Santinatornkul",,2021-09-23,2021,TV-MA,1 Season,"Crime TV Shows, International TV Shows, TV Action & Adventure","Struggling to earn a living in Bangkok, a man joins an emergency rescue service and realizes he must unravel a citywide conspiracy.",11,5.8,2021.0
s13,Movie,Je Suis Karl,Christian Schwochow,"Luna Wedler, Jannis Niewöhner, Milan Peschel, Edin Hasanović, Anna Fialová, Marlon Boess, Victor Boccard, Fleur Geffrier, Aziz Dyab, Mélanie Fouché, Elizaveta Maximová","Germany, Czech Republic",2021-09-23,2021,TV-MA,127 min,"Dramas, International Movies","After most of her family is murdered in a terrorist bombing, a young woman is unknowingly lured into joining the very group that killed them.",12,5.5,2021.0
s19,Movie,Intrusion,Adam Salky,"Freida Pinto, Logan Marshall-Green, Robert John Burke, Megan Elisabeth Kelly, Sarah Minnich, Hayes Hargrove, Mark Sivertsen, Brandon Fierro, Antonio Valles, Clint Obenchain",,2021-09-22,2021,TV-14,94 min,Thrillers,"After a deadly home invasion at a couple’s new dream house, the traumatized wife searches for answers — and learns the real danger is just beginning.",18,5.3,2021.0
s22,TV Show,Resurrection: Ertugrul,,"Engin Altan Düzyatan, Serdar Gökhan, Hülya Darcan, Kaan Taşaner, Esra Bilgiç, Osman Soykut, Serdar Deniz, Cengiz Coşkun, Reshad Strik, Hande Subaşı",Turkey,2021-09-22,2018,TV-14,5 Seasons,"International TV Shows, TV Action & Adventure, TV Dramas","When a good deed unwittingly endangers his clan, a 13th-century Turkish warrior agrees to fight a sultan's enemies in exchange for new tribal land.",21,7.9,2021.0
s21,TV Show,Monsters Inside: The 24 Faces of Billy Milligan,Olivier Megaton,,,2021-09-22,2021,TV-14,1 Season,"Crime TV Shows, Docuseries, International TV Shows","In the late 1970s, an accused serial rapist claims multiple personalities control his behavior, setting off a legal odyssey that captivates America.",20,6.3,2021.0
s20,TV Show,Jaguar,,"Blanca Suárez, Iván Marcos, Óscar Casas, Adrián Lastra, Francesc Garrido, Stefan Weinert, Julia Möller, Alicia Chojnowski",,2021-09-22,2021,TV-MA,1 Season,"International TV Shows, Spanish-Language TV Shows, TV Action & Adventure","In the 1960s, a Holocaust survivor joins a group of self-trained spies who seek justice against Nazis fleeing to Spain to hide after WWII.",19,5.8,2021.0
s16,TV Show,Dear White People,,"Logan Browning, Brandon P. Bell, DeRon Horton, Antoinette Robertson, John Patrick Amedori, Ashley Blaine Featherson, Marque Richardson, Giancarlo Esposito",United States,2021-09-22,2021,TV-MA,4 Seasons,"TV Comedies, TV Dramas","Students of color navigate the daily slights and slippery politics of life at an Ivy League college that's not nearly as ""post-racial"" as it thinks.",15,6.4,2021.0
s18,TV Show,Falsa identidad,,"Luis Ernesto Franco, Camila Sodi, Sergio Goyri, Samadhi Zendejas, Eduardo Yáñez, Sonya Smith, Alejandro Camacho, Azela Robinson, Uriel del Toro, Géraldine Bazán, Gabriela Roel, Marcus Ornellas",Mexico,2021-09-22,2020,TV-MA,2 Seasons,"Crime TV Shows, Spanish-Language TV Shows, TV Dramas",Strangers Diego and Isabel flee their home in Mexico and pretend to be a married couple to escape his drug-dealing enemies and her abusive husband.,17,7.1,2021.0
s17,Movie,Europe's Most Dangerous Man: Otto Skorzeny in Spain,"Pedro de Echave García, Pablo Azorín Williams",,,2021-09-22,2020,TV-MA,67 min,"Documentaries, International Movies","Declassified documents reveal the post-WWII life of Otto Skorzeny, a close Hitler ally who escaped to Spain and became an adviser to world presidents.",16,6.7,2021.0
s15,TV Show,Crime Stories: India Detectives,,,,2021-09-22,2021,TV-MA,1 Season,"British TV Shows, Crime TV Shows, Docuseries",Cameras following Bengaluru police on the job offer a rare glimpse into the complex and challenging inner workings of four major crime investigations.,14,7.0,2021.0
s14,Movie,Confessions of an Invisible Girl,Bruno Garotti,"Klara Castanho, Lucca Picon, Júlia Gomes, Marcus Bessa, Kiria Malheiros, Fernanda Concon, Gabriel Lima, Caio Cabral, Leonardo Cidade, Jade Cardozo",,2021-09-22,2021,TV-PG,91 min,"Children & Family Movies, Comedies","When the clever but socially-awkward Tetê joins a new school, she'll do anything to fit in. But the queen bee among her classmates has other ideas.",13,5.3,2021.0
s26,TV Show,Love on the Spectrum,,Brooke Satchwell,Australia,2021-09-21,2021,TV-14,2 Seasons,"Docuseries, International TV Shows, Reality TV","Finding love can be hard for anyone. For young adults on the autism spectrum, exploring the unpredictable world of dating is even more complicated.",25,8.6,2021.0
s27,Movie,Minsara Kanavu,Rajiv Menon,"Arvind Swamy, Kajol, Prabhu Deva, Nassar, S.P. Balasubrahmanyam, Girish Karnad",,2021-09-21,1997,TV-PG,147 min,"Comedies, International Movies, Music & Musicals",A tangled love triangle ensues when a man falls for a woman studying to become a nun — and she falls for the friend he enlists to help him pursue her.,26,6.7,2021.0
s25,Movie,Jeans,S. Shankar,"Prashanth, Aishwarya Rai Bachchan, Sri Lakshmi, Nassar",India,2021-09-21,1998,TV-14,166 min,"Comedies, International Movies, Romantic Movies","When the father of the man she loves insists that his twin sons marry twin sisters, a woman creates an alter ego that might be a bit too convincing.",24,6.4,2021.0
s24,Movie,Go! Go! Cory Carson: Chrissy Takes the Wheel,"Alex Woo, Stanley Moore","Maisie Benson, Paul Killam, Kerry Gudjohnsen, AC Lim",,2021-09-21,2021,TV-Y,61 min,Children & Family Movies,"From arcade games to sled days and hiccup cures, Cory Carson’s curious little sister Chrissy speeds off on her own for fun and adventure all over town!",23,6.6,2021.0
s23,Movie,Avvai Shanmughi,K.S. Ravikumar,"Kamal Hassan, Meena, Gemini Ganesan, Heera Rajgopal, Nassar, S.P. Balasubrahmanyam",,2021-09-21,1996,TV-PG,161 min,"Comedies, International Movies","Newly divorced and denied visitation rights with his daughter, a doting father disguises himself as a gray-haired nanny in order to spend time with her.",22,7.9,2021.0
s28,Movie,Grown Ups,Dennis Dugan,"Adam Sandler, Kevin James, Chris Rock, David Spade, Rob Schneider, Salma Hayek, Maria Bello, Maya Rudolph, Colin Quinn, Tim Meadows, Joyce Van Patten",United States,2021-09-20,2010,PG-13,103 min,Comedies,"Mourning the loss of their beloved junior high basketball coach, five middle-aged pals reunite at a lake house and rediscover the joys of being a kid.",27,6.0,2021.0
s29,Movie,Dark Skies,Scott Stewart,"Keri Russell, Josh Hamilton, J.K. Simmons, Dakota Goyo, Kadan Rockett, L.J. Benet, Rich Hutchman, Myndy Crist, Annie Thurman, Jake Brennan",United States,2021-09-19,2013,PG-13,97 min,"Horror Movies, Sci-Fi & Fantasy","A family’s idyllic suburban life shatters when an alien force invades their home, and as they struggle to convince others of the deadly threat.",28,6.3,2021.0
s30,Movie,Paranoia,Robert Luketic,"Liam Hemsworth, Gary Oldman, Amber Heard, Harrison Ford, Lucas Till, Embeth Davidtz, Julian McMahon, Josh Holloway, Richard Dreyfuss, Angela Sarafyan","United States, India, France",2021-09-19,2013,PG-13,106 min,Thrillers,"Blackmailed by his company's CEO, a low-level employee finds himself forced to spy on the boss's rival and former mentor.",29,5.6,2021.0
s31,Movie,Ankahi Kahaniya,"Ashwiny Iyer Tiwari, Abhishek Chaubey, Saket Chaudhary","Abhishek Banerjee, Rinku Rajguru, Delzad Hiwale, Kunal Kapoor, Zoya Hussain, Nikhil Dwivedi, Palomi Ghosh",,2021-09-17,2021,TV-14,111 min,"Dramas, Independent Movies, International Movies","As big city life buzzes around them, lonely souls discover surprising sources of connection and companionship in three tales of love, loss and longing.",30,5.6,2021.0
s32,TV Show,Chicago Party Aunt,,"Lauren Ash, Rory O'Malley, RuPaul Charles, Jill Talley, Ike Barinholtz, Jon Barinholtz, Matthew Craig, Bob Odenkirk, Mike Hagerty, Katie Rich, Chris Witaske",,2021-09-17,2021,TV-MA,1 Season,TV Comedies,Chicago Party Aunt Diane is an idolized troublemaker with a talent for avoiding adulthood — and a soft spot for her soul-searching nephew.,31,5.6,2021.0
s33,TV Show,Sex Education,,"Asa Butterfield, Gillian Anderson, Ncuti Gatwa, Emma Mackey, Connor Swindells, Kedar Williams-Stirling, Alistair Petrie",United Kingdom,2021-09-17,2020,TV-MA,3 Seasons,"British TV Shows, International TV Shows, TV Comedies","Insecure Otis has all the answers when it comes to sex advice, thanks to his therapist mom. So rebel Maeve proposes a school sex-therapy clinic.",32,8.2,2021.0
s34,TV Show,Squid Game,,"Lee Jung-jae, Park Hae-soo, Wi Ha-jun, Oh Young-soo, Jung Ho-yeon, Heo Sung-tae, Kim Joo-ryoung, Tripathi Anupam, You Seong-joo, Lee You-mi",,2021-09-17,2021,TV-MA,1 Season,"International TV Shows, TV Dramas, TV Thrillers","Hundreds of cash-strapped players accept a strange invitation to compete in children's games. Inside, a tempting prize awaits — with deadly high stakes.",33,8.0,2021.0
s36,Movie,The Father Who Moves Mountains,Daniel Sandu,"Adrian Titieni, Elena Purea, Judith State, Valeriu Andriuță, Tudor Smoleanu, Virgil Aioanei, Radu Botar, Petronela Grigorescu, Bogdan Nechifor, Cristian Bota",,2021-09-17,2021,TV-MA,110 min,"Dramas, International Movies, Thrillers","When his son goes missing during a snowy hike in the mountains, a retired intelligence officer will stop at nothing — and risk everything — to find him.",35,5.6,2021.0
s37,Movie,The Stronghold,Cédric Jimenez,"Gilles Lellouche, Karim Leklou, François Civil, Adèle Exarchopoulos, Kenza Fortas, Cyril Lecomte, Michaël Abiteboul, Idir Azougli, Vincent Darmuzey, Jean-Yves Berteloot",,2021-09-17,2021,TV-MA,105 min,"Action & Adventure, Dramas, International Movies","Tired of the small-time grind, three Marseille cops get a chance to bust a major drug network. But lines blur when a key informant makes a big ask.",36,6.9,2021.0
s44,Movie,Jaws 3,Joe Alves,"Dennis Quaid, Bess Armstrong, Simon MacCorkindale, Louis Gossett Jr., John Putch, Lea Thompson, P.H. Moriarty, Dan Blasko, Liz Morris, Lisa Maurer",United States,2021-09-16,1983,PG,98 min,"Action & Adventure, Horror Movies, Thrillers","After the staff of a marine theme park try to capture a young great white shark, they discover its mother has invaded the enclosure and is out for blood.",43,3.7,2021.0
s49,Movie,Training Day,Antoine Fuqua,"Denzel Washington, Ethan Hawke, Scott Glenn, Tom Berenger, Harris Yulin, Raymond J. Barry, Cliff Curtis, Dr. Dre, Snoop Dogg, Macy Gray, Eva Mendes",United States,2021-09-16,2001,R,122 min,"Dramas, Thrillers",A rookie cop with one day to prove himself to a veteran LAPD narcotics officer receives a crash course in his mentor's questionable brand of justice.,48,7.7,2021.0
s48,TV Show,The Smart Money Woman,Bunmi Ajakaiye,"Osas Ighodaro, Ini Dima-Okojie, Kemi Lala Akindoju, Toni Tones, Ebenezer Eno, Eso Okolocha DIke, Patrick Diabuah, Karibi Fubara, Temisan Emmanuel, Timini Egbuson",,2021-09-16,2020,TV-MA,1 Season,"International TV Shows, Romantic TV Shows, TV Comedies","Five glamorous millennials strive for success as they juggle careers, finances, love and friendships. Based on Arese Ugwu's 2016 best-selling novel.",47,6.7,2021.0
s47,Movie,Safe House,Daniel Espinosa,"Denzel Washington, Ryan Reynolds, Vera Farmiga, Brendan Gleeson, Sam Shepard, Rubén Blades, Nora Arnezeder, Robert Patrick, Liam Cunningham, Joel Kinnaman","South Africa, United States, Japan",2021-09-16,2012,R,115 min,Action & Adventure,Young CIA operative Matt Weston must get a dangerous criminal out of an agency safe house that's come under attack and get him to a securer location.,46,6.7,2021.0
s45,Movie,Jaws: The Revenge,Joseph Sargent,"Lorraine Gary, Lance Guest, Mario Van Peebles, Karen Young, Michael Caine, Judith Barsi, Mitchell Anderson, Lynn Whitfield",United States,2021-09-16,1987,PG-13,91 min,"Action & Adventure, Horror Movies, Thrillers","After another deadly shark attack, Ellen Brody has had enough of Amity Island and moves to the Caribbean – but a great white shark follows her there.",44,3.0,2021.0
s46,Movie,My Heroes Were Cowboys,Tyler Greco,,,2021-09-16,2021,PG,23 min,Documentaries,"Robin Wiltshire's painful childhood was rescued by Westerns. Now he lives on the frontier of his dreams, training the horses he loves for the big screen.",45,6.7,2021.0
s43,Movie,Jaws 2,Jeannot Szwarc,"Roy Scheider, Lorraine Gary, Murray Hamilton, Joseph Mascolo, Jeffrey Kramer, Collin Wilcox Paxton, Ann Dusenberry, Mark Gruner, Barry Coe, Susan French",United States,2021-09-16,1978,PG,116 min,"Dramas, Horror Movies, Thrillers","Four years after the last deadly shark attacks, police chief Martin Brody fights to protect Amity Island from another killer great white.",42,5.8,2021.0
s38,TV Show,Angry Birds,,"Antti Pääkkönen, Heljä Heikkinen, Lynne Guaglione, Pasi Ruohonen, Rauno Ahonen",Finland,2021-09-16,2018,TV-Y7,1 Season,"Kids' TV, TV Comedies","Birds Red, Chuck and their feathered friends have lots of adventures while guarding eggs in their nest that pesky pigs keep trying to steal.",37,6.3,2021.0
s41,TV Show,He-Man and the Masters of the Universe,,"Yuri Lowenthal, Kimberly Brooks, Antony Del Rio, Trevor Devall, Ben Diskin, Grey Griffin, David Kaye, Tom Kenny, Judy Alice Lee, Roger Craig Smith, Fred Tatasciore",United States,2021-09-16,2021,TV-Y7,1 Season,"Kids' TV, TV Sci-Fi & Fantasy",Mighty teen Adam and his heroic squad of misfits discover the legendary power of Grayskull — and their destiny to defend Eternia from sinister Skeletor.,40,7.5,2021.0
s40,TV Show,Chhota Bheem,,"Vatsal Dubey, Julie Tejwani, Rupa Bhimani, Jigna Bhardwaj, Rajesh Kava, Mousam, Swapnil",India,2021-09-16,2021,TV-Y7,3 Seasons,Kids' TV,"A brave, energetic little boy with superhuman powers leads his friends on exciting adventures to guard their fellow Dholakpur villagers from evil.",39,7.0,2021.0
s39,Movie,Birth of the Dragon,George Nolfi,"Billy Magnussen, Ron Yuan, Qu Jingjing, Terry Chen, Vanness Wu, Jin Xing, Philip Ng, Xia Yu, Yu Xia","China, Canada, United States",2021-09-16,2017,PG-13,96 min,"Action & Adventure, Dramas","A young Bruce Lee angers kung fu traditionalists by teaching outsiders, leading to a showdown with a Shaolin master in this film based on real events.",38,5.7,2021.0
s42,Movie,Jaws,Steven Spielberg,"Roy Scheider, Robert Shaw, Richard Dreyfuss, Lorraine Gary, Murray Hamilton, Carl Gottlieb, Jeffrey Kramer, Susan Backlinie, Jonathan Filley, Ted Grossman",United States,2021-09-16,1975,PG,124 min,"Action & Adventure, Classic Movies, Dramas","When an insatiable great white shark terrorizes Amity Island, a police chief, an oceanographer and a grizzled shark hunter seek to destroy the beast.",41,8.1,2021.0
s60,Movie,Naruto Shippuden: The Movie,Hajime Kamegaki,"Junko Takeuchi, Chie Nakamura, Yoichi Masukawa, Koichi Tochika, Ayumi Fujimura, Keisuke Oda, Daisuke Kishio, Fumiko Orikasa, Hidetoshi Nakamura, Tetsuya Kakihara, Kisho Taniyama, Miyuki Sawashiro, Katsuyuki Konishi, Masako Katsuki, Keiko Nemoto, Masashi Ebara, Kazuhiko Inoue, Showtaro Morikubo, Romi Park, Daisuke Ono, Seizo Kato",Japan,2021-09-15,2007,TV-PG,95 min,"Action & Adventure, Anime Features, International Movies","The adventures of adolescent ninja Naruto Uzumaki continue as he's tasked with protecting a priestess from a demon – but to do so, he must die.",59,6.7,2021.0
s71,TV Show,Too Hot To Handle: Latino,,Itatí Cantoral,,2021-09-15,2021,TV-MA,1 Season,"International TV Shows, Reality TV, Romantic TV Shows","On this reality show, singles from Latin America and Spain are challenged to give up sex. But here, abstinence comes with a silver lining: US$100,000.",70,4.8,2021.0
s70,TV Show,Stories by Rabindranath Tagore,,,India,2021-09-15,2015,TV-PG,1 Season,"International TV Shows, TV Dramas",The writings of Nobel Prize winner Rabindranath Tagore come to life in this collection of tales set in early-20th-century Bengal.,69,8.6,2021.0
s69,Movie,Schumacher,"Hanns-Bruno Kammertöns, Vanessa Nöcker, Michael Wech",Michael Schumacher,,2021-09-15,2021,TV-14,113 min,"Documentaries, International Movies, Sports Movies","Through exclusive interviews and archival footage, this documentary traces an intimate portrait of seven-time Formula 1 champion Michael Schumacher.",68,7.4,2021.0
s68,TV Show,Saved by the Bell,,"Mark-Paul Gosselaar, Tiffani Thiessen, Mario Lopez, Lark Voorhies, Elizabeth Berkley, Dustin Diamond, Dennis Haskins",United States,2021-09-15,1994,TV-PG,9 Seasons,"Kids' TV, TV Comedies","From middle school to college, best friends Zack, Kelly, Slater, Jessie, Screech and Lisa take on the highs and lows of life together in this hit series.",67,7.1,2021.0
s66,TV Show,Numberblocks,,"Beth Chalmers, David Holt, Marcel McCalla, Teresa Gallagher",United Kingdom,2021-09-15,2021,TV-Y,6 Seasons,Kids' TV,"In a place called Numberland, math adds up to tons of fun when a group of cheerful blocks work, play and sing together.",65,8.5,2021.0
s65,Movie,Nightbooks,David Yarovesky,"Winslow Fegley, Lidya Jewett, Krysten Ritter",,2021-09-15,2021,TV-PG,103 min,Children & Family Movies,Scary story fan Alex must tell a spine-tingling tale every night — or stay trapped with his new friend in a wicked witch's magical apartment forever.,64,5.8,2021.0
s64,Movie,Naruto the Movie: Ninja Clash in the Land of Snow,Tensai Okamura,"Junko Takeuchi, Noriaki Sugiyama, Chie Nakamura, Kazuhiko Inoue, Yuhko Kaida, Tsutomu Isobe, Hirotaka Suzuoki, Jun Karasawa, Harii Kaneko, Ikuo Nishikawa",Japan,2021-09-15,2004,TV-PG,83 min,"Action & Adventure, Anime Features, International Movies","Naruto, Sasuke and Sakura learn they'll be protecting an actress from being hurt while making her next film, but it turns out she's a princess.",63,7.3,2021.0
s62,Movie,Naruto the Movie 2: Legend of the Stone of Gelel,Hirotsugu Kawasaki,"Junko Takeuchi, Gamon Kaai, Chie Nakamura, Showtaro Morikubo, Akira Ishida, Yasuyuki Kase, Urara Takano, Sachiko Kojima, Houko Kuwashima, Takako Honda",Japan,2021-09-15,2005,TV-PG,97 min,"Action & Adventure, Anime Features, International Movies","While on a mission to return a missing pet, Naruto and two fellow ninjas are ambushed by brutal knights led by the enigmatic Temujin.",61,8.6,2021.0
s61,Movie,Naruto Shippuden: The Movie: The Lost Tower,Masahiko Murata,"Junko Takeuchi, Chie Nakamura, Satoshi Hino, Rikiya Koyama, Nobuaki Fukuda, Kenji Hamada, Keiko Nemoto, Saori Hayami, Yumi Toma, Yuko Kobayashi, Fujiko Takimoto, Mutsumi Tamura, Mayuki Makiguchi, Toshiyuki Morikawa",Japan,2021-09-15,2010,TV-14,85 min,"Action & Adventure, Anime Features, International Movies","When Naruto is sent to recover a missing nin, the rogue manages to send him 20 years into the past, where he unites with his father to battle evil.",60,6.7,2021.0
s63,Movie,Naruto the Movie 3: Guardians of the Crescent Moon Kingdom,Toshiyuki Tsuru,"Junko Takeuchi, Chie Nakamura, Yoichi Masukawa, Kazuhiko Inoue, Akio Otsuka, Kyousuke Ikeda, Marika Hayashi, Umeji Sasaki, Masashi Sugawara, Hisao Egawa",Japan,2021-09-15,2006,TV-PG,95 min,"Action & Adventure, Anime Features, International Movies","Exuberant ninja Naruto teams up with his pals Sakura and Kakashi to escort Prince Michiru and his son, Hikaru, to the Crescent Moon kingdom.",62,6.3,2021.0
s59,Movie,Naruto Shippûden the Movie: The Will of Fire,Masahiko Murata,"Junko Takeuchi, Chie Nakamura, Kazuhiko Inoue, Satoshi Hino, Showtaro Morikubo, Kentaro Ito, Ryoka Yuzuki, Kohsuke Toriumi, Nana Mizuki, Shinji Kawada, Yoichi Masukawa, Koichi Tochika, Yukari Tamura",Japan,2021-09-15,2009,TV-PG,96 min,"Action & Adventure, Anime Features, International Movies","When four out of five ninja villages are destroyed, the leader of the one spared tries to find the true culprit and protect his land.",58,7.0,2021.0
s57,Movie,Naruto Shippuden the Movie: Blood Prison,Masahiko Murata,"Junko Takeuchi, Chie Nakamura, Rikiya Koyama, Kazuhiko Inoue, Masaki Terasoma, Mie Sonozaki, Yuichi Nakamura, Kengo Kawanishi, Kosei Hirota, Masako Katsuki",Japan,2021-09-15,2011,TV-14,102 min,"Action & Adventure, Anime Features, International Movies","Mistakenly accused of an attack on the Fourth Raikage, ninja Naruto is imprisoned in the impenetrable Hozuki Castle and his powers are sealed.",56,7.1,2021.0
s56,TV Show,Nailed It,,"Nicole Byer, Jacques Torres",United States,2021-09-15,2021,TV-PG,6 Seasons,Reality TV,"Home bakers with a terrible track record take a crack at re-creating edible masterpieces for a $10,000 prize. It's part reality contest, part hot mess.",55,7.4,2021.0
